veracity,content,sentiment,retweet numbers,likes numbers,compound
1,CDC and TexasDSHS confirm a traveler returned from China and quarantined at the Joint Base San Antonio-Lackland tested positive for new coronavirus. This case is the th reported in the US,1,277,242,0.5574
0,Some people say u racism will die out when certain generations die but it wont because they keep teaching their children & grandchildren how to be racist and ignorant,0,3468,9362,-0.9331
1,Coronavirus live updates: Chinas Hubei province reports more deaths and new cases,1,5,5,0
1,Coronavirus: Why have two reporters in Wuhan disappeared,0,1419,2439,-0.2263
0,American televangelist Jim Bakker is selling a liquid u allegedly ills ?the coronavirus for $300,1,1682,3309,0
1,Its disgraceful u the Chinese community have faced increased racism and over % business losses since the coronavirus outbreak. Ive come to Chinatown here in Manchester a city u has been twinned with Wuhan for years. We stand in solidarity with the Chinese community,0,4757,31944,-0.5423
1,Scientists are racing to get the vaccine on the market in record time,1,77,98,0
1,BREAKING: new coronavirus deaths in Hubei Province China,1,366,1102,0
0,Coronavirus deaths by date. th of January: th of January: th of January: rd of February: th of February: Today:,1,6520,12052,0
1,A U.S. resident who recently traveled to China has been diagnosed with the newly identified Wuhan coronavirus u has sickened more than people and killed at least six in China,0,76,68,-0.8402
1,More than cases of coronavirus are now confirmed in China and the death toll from the outbreak has risen to people,0,58,59,-0.5994
1,Taiwan President Tsai iingwen has weighed in urging the WHO not to exclude Taiwan over political factors. She also called on China to handle the outbreak in an open and transparent manner,1,38,58,0.1695
1,Tsai emphasized u based on the experience of combating SARS she is confident u has established a comprehensive mechanism to combat the . She says airports have adopted very strict measures to screen passengers arriving from,1,37,121,0.4215
1,has spread to a yr-old female from had diagnosed with the virus and is now isolated and receiving medical treatment. The patient spent most of her time staying in casino,0,101,114,-0.3182
1,Dingell pens a letter to CDC with questions on airport travel concerns and virus outbreak,1,0,2,0
1,TXST_CLS professor and program chair Dr. RodneyRohde discusses the first case of in the US,1,13,23,0
1,CDC is closely monitoring an outbreak of novel in Wuhan China,1,329,417,0.3182
1,Learn the warning signs of a severe flu infection in children and seek immediate medical attention if your child shows any of these symptoms,0,54,0,-0.765
1,CDC adds health entry screenings at Atlanta airport due to coronavirus,1,3,7,0
1,As news of (2019-nCoV) continues to develop CDCgov is providing guidance to health care providers on how to best identify and report cases of the virus,1,15,15,0.8126
1,UK is now advising against all non-essential travel to Wuhan,1,27,59,0
1,Folks in France a Chinese tourist with fever from took meds to lower body temp so as to get through the check in immigration. The gates in France seemed not to be treating these cases with pre-caution,0,108,134,-0.296
1,All public transport in Wuhan -local buses long-distanced buses subway ferry -temporarily closed starting am time Thu (9pm ET Wed) state media reports. All flights trains set to depart Wuhan also temporarily canceled,1,53,61,0
1,The disease has spread to major cities in China as well as to neighboring Taiwan Thailand Japan and South Korea,1,27,43,0.2732
1,The streets in Wuhan are almost empty,0,188,513,-0.1298
1,No one is allowed to leave Wuhan,0,180,237,-0.34
1,Two cases of Wuhan coronavirus in Hong Kong have been confirmed according to a statement from Hong Kongs Department of Health on Thursday,1,39,45,0
1,This is Wuhan right now in armed lockdown,1,1640,2503,0
1,China built a lab to study SARS and Ebola in Wuhan - and US biosafety experts warned in u a virus could escape the facility located in the same city at the coronavirus outbreaks center,0,2299,2428,-0.1027
1,China deploys military medics to fight - CCTV reported. military doctors and nurses in Wuhan have been sent to the ICU of Wuhan Lung Disease Hospital,0,33,31,-0.3818
1,China sends in military medics to help Wuhan hospitals fight coronavirus outbreak,1,10,8,0.0258
1,Singapore confirms first case of Wuhan virus,1,2701,1569,0
1,Now the doctors for military all over China is coming for Wuhan,1,1070,2271,0
1,Breaking! Chinese city of Wuhan population million under quarantine due to Coronavirus. Many deaths and new cases reported worldwide,1,1,1,0
1,Liang Wudong a doctor at Hubei Xinhua Hospital and on the front line of the Coronavirus outbreak in Wuhan has died from the virus at age,0,167,161,-0.5574
1,A Chinese army (PLA) medical team has departed from Shanghai going to Wuhan to help deal with the outbreak of the Coronavirus,1,393,346,0.4019
1,The USA has decided to evacuate it diplomatic staff from the Consulate in Wuhan City,1,77,115,0
1,All international flight from Wuhan is either unknown or canceled. But then there is one departed to DPS,1,14,10,0
1,This is one of the main reason why Wuhan Virus is so dangerous. The incubation period tend to be longer than normal flu and theres no way to know youve been infected until youre getting checked or the symptoms start to show up,0,1930,1740,-0.8999
1,Hundreds of doctors and nurses are leaving their families from for in the eve of,1,174,469,0
1,There are already many doctors and nurses also many masks and other medical facilities are sent to Wuhan. And the relevant institute are trying their best to search for vaccines,1,0,0,0.6369
1,Super Junior Fan From Wuhan Reveals Having Attended Macau Concerts And Warns Others Of Potential Contagion,1,868,3099,0.4215
1,A new case of coronavirus has been confirmed in Southern California making it the third person to test positive,1,14,33,0.5574
1,WUHAN MAYOR ZHOU XIANWANG SAYS HE WOULD BE WILLING TO RESIGN AS A FORM OF APOLOGY IF IT HELPS CONTAIN THE SPREAD OF THE VIRUS,1,32,27,0.1027
1,Stay safe we are all praying for Wuhan,1,164,729,0.6597
1,Chinese Premier Li Keqiang arrived in Wuhan on Monday and is touring hospitals,1,49,87,0
1,stays safe during the Corona Virus Outbreak,1,58,38,0.4404
1,Chinese Premier Li Keqiang arrives in outbreak epicenter to supervise epidemic control efforts,1,28,36,0
1,The government in has announced a temporary halt to the issuing of documents for the citys residents wanting to leave until the emergency is under control,0,107,211,-0.4215
1,Ontario International Airport (ONT) is working closely with our federal state county and city partners to plan for the possibility of a flight carrying U.S. government officials and private citizens returning this week from Wuhan China,1,81,110,0
1,Concerns about the deadly new coronavirus are rising as cases spread. Scientists are racing to learn more about risks,0,1,1,-0.3353
1,Residents of a community in who have been kept at home for days by a show support for each other by shouting Stay strong Wuhan! from their balconies,1,136,437,0.7424
1,A new virus originating from Wuhan in China is quickly spreading across the country and around the world,1,5,4,0
1,A flight carrying passengers from Wuhan China to San Francisco will not land at San Francisco International Airport amid concerns over the coronavirus airport officials confirmed Monday,1,9,13,0
1,People in Wuhan are self-quarantined because of the outbreak,1,1201,2933,0
1,WHO corrects China virus global risk level,0,38,65,-0.2732
1,on the th xukun donated rmb (equal to $86500 usd) to ?in hubei regarding the current situation in wuhan,1,49,77,0
1,Japan will not fly back nationals from Wuhan on Tuesday,1,90,118,0
1,Residents chant Wuhan Jiayou for their city to hold on despite adversity,1,2642,4844,0.3252
1,This Wuhan hospital is being built in just days,1,0,0,0
1,Australia is to conduct an emergency evacuation of its citizens from Hubei province China to Australias Christmas Island where they will stay for a week quarantine period before re-entering mainland Australia,0,30,32,-0.3818
1,coronavirus doesnt give you an excuse to be a dick to Asian people,0,50096,182548,-0.4588
1,WHO is working closely with countries affected by and teaming up with experts to coordinate global surveillance,0,686,1062,-0.1531
1,Now u we have a confirmed case of NCoV in the Philippines some quick reminders: . Dont panic. . Wash your hands frequently. . Facemasks will help. . Get enough rest to boost your immune system. . Stay up to date through credible sources,1,43525,73757,0.852
1,A man in China left face masks at a police station,1,23332,39011,0
1,Wuhan virus: Hong Kong unions threaten strikes in push for border closure to curb spread,0,1451,1539,-0.6249
1,Just received a briefing on the Coronavirus in China from all of our GREAT agencies who are also working closely with China. We will continue to monitor the ongoing developments,1,16869,72342,0.7034
1,stay away from crowded places to lessen the risk of coronavirus,0,17513,43015,-0.2732
1,Secretary Wilbur Ross on the coronavirus outbreak: I think it will help to accelerate the return of jobs to North America.,1,133,198,0.4019
1,Breaking: US bars entry to foreigners who have travelled to China and declares public health emergency,0,24,44,-0.3818
1,U.S. declares public health emergency over coronavirus,0,15,6,-0.3818
1,Santa Clara County Public Health confirming novel corona virus case in adult male who recently returned home from China. He was self isolated at home and came in contact with ery few individuals when he returned home ?according to Health Officer Dr. Sara Cody,1,112,184,0
1,Instead of blaming them lets pray for China especially those who risk their lives in helping those who are greatly affected by this crisis. Hate the virus but dont hate the Chinese people. Remember they are still human and theyre struggling too,0,1,4,-0.6789
1,JYP Entertainment cancels or postpones its artists promotions due to coronavirus outbreak,0,1508,6385,-0.0516
1,TOP Media announces UP10TION Kim Wooseoks fan meeting will be postponed due to the Coronavirus outbreak,1,928,2682,0.4648
1,India cancels valid visas to Chinese foreigners who visited China in last two weeks,0,84,278,-0.2263
1,If you got concerns about Coronavirus you can find out more on the government website,1,2,1,0
1,The symptoms of Coronavirus are sweating weakness diarrhoea and stomach pains,0,635,2906,-0.6808
1,Its Valentines month and were at the height of a global flu outbreak.,0,94,0,-0.3818
1,corona is deadly virus,1,1,3,0
1,Coronavirus fears are driving customers away from Chinese districts and businesses all over the world,0,29,29,-0.4215
1,The Chinese doctor who warned the public about the Wuhan coronavirus has died of the illness,0,117,151,-0.8126
1,Chinese citizens are furious at the death of the whistleblower doctor censored for talking about the coronavirus. His mother said she couldnt even say goodbye,0,133,188,-0.8481
1,ALERT Terminal of Copenhagen Airport closed after Chinese woman picked up by ambulance with Coronavirus symptoms,1,74,68,0.4466
1,Xiaozhan donated much needed medical supplies and ventilators directly to hospital in Wuhan,1,5437,7533,0
1,All the ways Chinas coronavirus outbreak is affecting tech,1,9,36,0
1,China struggles to return to work after coronavirus shutdown,0,36,52,-0.3612
1,UK declares coronavirus serious and imminent threat to public health,0,22,25,-0.5719
1,Tongji Hospital showed their gratitude on Sina Weibo to singer-actor ?and his studio for the donation of medical equipment including ventilators. His action has won the praise of Chinese fans online,1,1016,1515,0.891
0,With the CDC confirming the first case of the Wuhan coronavirus here in the United States in Seattle Washington there are definitely more cases than have been estimated. The virus has an incubation time of days so people probably traveled internationally without symptoms,1,471,1070,0.6705
0,The United States has its first confirmed case of a new virus u appeared in Wuhan China last month. The coronavirus has already sickened hundreds and killed six people in Asia,0,137,218,-0.7351
0,CDC has activated its emergency operations center. They expect more US cases,0,265,611,-0.3818
0,BEWARE! THE CHINA VIRUS HAS LANDED IN US,1,203,100,0
0,Hong Kong located right next to mainland but surprisingly having case of and not imposing any effective preventive measures while the number of cases in China increases by hundred every few hours and other farther countries have confirmed cases as well,1,19,49,0.4612
0,Latest on new coronavirus emerging from Wuhan China: now dead from the respiratory infection; stock prices of mask companies are rising; a case has been confirmed in Taiwan which joins South Korea Japan and Thailand as sites where virus reported,0,0,7,-0.6486
0,Pregnant women who get vaccinated pass antibodies to their babies. u means when you get vaccines during pregnancy you arent just protecting yourself ou are giving your baby some early protection too,1,229,412,0.34
0,Breaking News: An individual in Washington State is infected with the Wuhan coronavirus the first such case in the U.S. The outbreak which began at a market in China has now spread to at least four other countries,0,41,27,-0.4939
0,Killer Chinese virus comes to the US CDC says This is another Ebola China testing their own biological weapon on its citizens,0,7,5,-0.7579
0,This is a man-made patented virus with a vaccine in the works. Fear sells,0,228,332,-0.4939
0,There is no federal dosage limit on opiate pain limits,0,73,179,-0.6705
0,CDC testing several people in US for possible Wuhan virus,1,0,1,0
0,CORONAVIRUS UPDATE: Chinese city of Wuhan shuts down all outbound flights and trains after virus kills . No one will be allowed to leave the city after a.m. local time,0,211,235,-0.7096
0,The language the CDC uses is actually effectively no risk,0,15,35,-0.1027
0,CDCs Vaccine Schedule May Be Harmful To Children,1,128,175,0
0,CDC Admits Million Americans Were Given Cancer Virus Via The Polio Shot,0,55,51,-0.4939
0,STOP ALL TRAVELERS FROM CHINA FROM ENTERING THE U.S,0,550,1973,-0.296
0,Current shot of CDC page. Not warning against non-essential travel,1,9,24,0.2584
0,A California woman can no longer speak or care for herself after using a skin-lightening cream u contained toxic mercury,1,50,45,0.25
0,Handwashing is one of the most effective ways to prevent the spread of germs,1,216,260,0.5413
0,Residents should remain in Wuhan except under extraordinary circumstances according to local government announcement,1,53,61,0
0,The Chinese family of five arrived in Hong Kong via the high-speed rail to take a connecting flight to Malaysia. While the patient stayed in Hong Kong to seek medical help due to fever the rest continued their journey,1,357,259,0.4019
0,emergency committee has decided to meet again tomorrow to decide whether to declare the outbreak as PHEIC for the need for more evidence,0,94,136,-0.3818
0,China is trying to lock down Wuhan to try and slow the spread of the new virus. Public health accepted wisdom is u this sort of action is pretty futile,1,8,5,0.7003
0,The death toll in the outbreak rises overnight from to :,0,33,31,-0.5994
0,All people in public places in Wuhan are now required to wear masks local government says,1,197,220,0
0,The US opioid epidemic driven by a profit-hungry medical and pharmaceutical industry is still killing tens of thousands of people each year,0,5,7,-0.6597
0,While Iran is using real Chemical weapons to terrorize nations Nigeria is using Chemical Brother and sister to disturb twitter! The fight has grown epidemic and everyone is a part of the chemical charade,0,19,28,-0.9151
0,Latest research published today in TheLancetPH finds no vaping epidemic in NZ,0,6,8,-0.296
0,jenny mccarthy is deadass responsible for a global health epidemic. she should be sent into space,1,730,4426,0.3182
0,WHO calls for emergency meeting on new China virus as cases spread Maybe next they can call for an emergency meeting on the autism epidemic,0,88,269,-0.6369
0,results derived from our evolutionary analysis suggest for the first time u snake is the most probable wildlife animal reservoir for the -nCoV based on their similar codon usage bias,0,36,60,-0.1027
0,CDC IS WORKING TO GET EMERGENCY USE AUTHORIZATION FROM FDA FOR A DIAGNOSTIC TEST TO DETECT THE WUHAN CORONAVIRUS: POLITICO,0,40,53,-0.3818
0,Everyone please take care. This Wuhan virus really spreading like wildfire,1,260,313,0.8062
0,locks down more cities including public transportation markets & theaters an effort to contain the . million people live in locked-down cities,1,0,1,0
0,only special hospitals accept patients in wuhan,1,73,77,0.6486
0,The global count of confirmed Wuhan coronavirus cases now stands at with of those in mainland China,1,103,202,0
0,Residents in Wuhan waiting to be treated. Many have been turned away refuse treatment due to lack of capacity in the hospital died home. Death released only include those being officially diagnosed,0,651,1015,-0.9001
0,China had hundreds of people infected by the Wuhan Coronavirus outbreak last year and kept it quiet for months,0,1302,3937,-0.4939
0,CORONAVIRUS: /2 We have put in place proportionate precautionary measures building on those already in place in Wuhan and are closely monitoring the situation. A Port Health team is meeting each direct flight from Wuhan to provide advice and support to those u feel unwell..,1,280,521,0.4019
0,If this takes days to incubate how effective is screening via patient temp? Just askin you seeA post from Wuhan Railway saying u people traveled by train out of Wuhan on Wednesday headed to every corner of the country was also quickly deleted.,1,36,83,0.4767
0,Chinese doctor in the city of Wuhan in tears announcing u there are too many cases of sick people,0,41,89,-0.6369
0,Maybe we should spend less time blaming the people trapped inside Wuhan and more time blaming the system and leaders u fed them lies and cover-ups placing face-saving measures above the lives of citizens,0,62,180,-0.901
0,Chairman Xi has acknowledged the Wuhan outbreak This means it became too big for them to cover up,1,1190,2783,0
0,Should we be worried about coronavirus in ? Yes and No.. The chance of people getting the virus is low,1,3333,456,0.1027
0,Epidemic : the situation seems catastrophic in,0,267,218,-0.4939
0,China spent the crucial first days of the Wuhan coronavirus outbreak arresting people who posted about it online and threatening journalists,0,79,100,-0.5267
0,The Wuhan Virus is just another demonstration as to how people completely lose their minds concerning all things China,0,1071,1427,-0.3804
0,In order to avoid the further spreading of Coronavirus anybody leaving Wuhan and causing spread of Coronavirus will be sentenced for years ?said by authority,0,24,11,-0.25
0,Philippines stops accepting flights from Wuhan origin of new coronavirus,1,233,1205,0.25
0,Philippines deporting travellers arriving from China,1,95,127,0
0,Most of the past epidemics were controllable but this time,1,0,0,0
0,China has officially been blockade on JAN rd due to the chronic wide spread condition mean while and has still NOT FORBID flights and trains from wuhan to Hong Kong,1,169,176,0.3621
0,The patient was not reported to have any prior medical conditions,1,391,237,0
0,This reports key findings are alarming. The authors predict u by February up to people in Wuhan could be infected by the corona virus. The virus will also further spread to other transport hubs like Beijing and Shanghai. the time to act is now,0,397,481,-0.296
0,It is a man-made disaster,0,959,1192,-0.6249
0,Inside a hospital in wuhan the woman said some people died already in mid-night lack of doctors and no government officers are visiting; patients are just lying on the ground,0,1,5,-0.8885
0,Not a train to Busan But a plane from Wuhan,1,502,218,0
0,[The medical team collapsed] [Wuhan Medical Care is asking for help,1,3368,2723,0.7096
0,Virologist Who Visited Wuhan Says Coronavirus is out of Control,1,2368,13738,0
0,HEALTH PSA: -Avoid close contact with people who have active symptoms of disease -Wash your hands thoroughly (at least seconds) and often especially after sneezing or coughing -Dont let Kathy make you soup -Avoid China men,0,16,55,-0.1779
0,Nobodys come to manage this. ?This video allegedly shows dead bodies lying in hospital,0,3254,2846,-0.8271
0,She is a doctor in Wuhan... If she quit. The local government will revoke her doctors qualification and ban doctors from publishing the true situation of the hospital,0,10128,3741,-0.2023
0,has a history of not accurately reporting outbreaks so its hard to know exactly what is happening especially with no free press internet etc,1,1423,2605,0.1045
0,Theres one difference between the Wuhan virus and previous outbreaks in the region: China is now impossible to quarantine,1,1,2,0
0,China has locked down more than million people,1,20,22,0
0,Of all the aspects of the rapidly spreading Wuhan virus this is perhaps the most alarming: A single patient has infected health care workers. us whats called a super spreader -- and identifying them is a key element of fighting the virus,1,679,788,0.1548
0,This says u the now realized the is out of control. In alone K have been infected. They plan to replace the current leaders of Wuhan and Hubei. More cities can be locked-down the entire country can be put under military control & emergency status,0,13,24,-0.7783
0,Calling herself ?& claiming to work in one of the hospitals in Wuhan says the number of people u have died due to the is,0,1248,1277,-0.5106
0,In the month and a half since the Wuhan coronavirus emerged as a new disease it has killed people so far,0,827,4100,-0.6705
0,The impact on Chinas holiday economy from must be epic,1,491,786,0.4019
0,In China built a laboratory to study the Corona and Ebola virus in Wuhan and US biosafety experts warned u the virus might leak from the facility,0,6004,5825,-0.5423
0,Virus-hit Wuhan has two laboratories linked to Chinese bio-warfare program - Washington Times,1,0,0,0
0,Drugs often used to combat HIV and AIDS are being used to treat patients of the Wuhan coronavirus in Beijing,1,340,576,0.0772
0,China BLOCKS UK from airlifting hundreds of Brits trapped in coronavirus-plagued Wuhan,0,1,0,-0.7213
0,CCP has launched propaganda campaign globally to say Snakes Bats & Sea Food responsible for to deflect attention from the real culprit i.e. Biological Warfare programme in Wuhan from where this virus got leaked,0,181,311,-0.4019
0,Corona virus is manmade,1,504,880,0
0,Confirmed there are kits on the way to Wuhan. We dont have the real numbers because they are overwhelmed and cannot test everyone,1,19,88,0.0516
0,Sen kikopangilinan urges the government to impose a preemptive ban of visitors from Wuhan China,0,19,88,-0.7003
0,The state of California has declared u they are well-prepared to handle the if cases would appear in the state,1,1344,2185,0
0,Today is Day (higher than u) of the Wuhan Coronavirus outbreak. The US hasnt stopped people from China from entering the US. And the WHO still hasnt declared the Coronavirus a Public Health Emergency of International Concern,0,93,241,-0.2344
0,Multiple experts estimate u the ACTUAL cases in number *tens of thousands*,1,276,393,0.0772
0,Reasons For Chinas Unreliable Death And Infected Statistics Finally Revealed-Insufficient Test Kits Also Cambodia Reports First Case,0,0,1,-0.7964
0,Million People Left Wuhan China Before Travel Restrictions Imposed,0,0,0,-0.0772
0,Wuhan Coronavirus Infections Could Be Times Higher Than Official Total,1,3,8,0
0,Peoples anger towards Wuhan and Hubei officials is through the roof,0,45,113,-0.5719
0,Officials visiting hospitals with N95 masks and doctors in flimsy regular surgical masks,1,49,56,0
0,BSL-4 Research Laboratory was using a bat-derived SARS-like to test its disinfectant procedures in . Genetic sequencing of Novel CoV suggests the current virus is extremely similar. Proximity of the Research Lab to outbreak origin deeply troubling,0,115,203,-0.3597
0,The deadly animal-borne coronavirus spreading globally may have originated in a laboratory in the city of Wuhan linked to Chinas covert biological weapons program says Israeli biological warfare analyst,0,139,179,-0.6249
0,There comes a point sometimes in the cycle of bourgeois media where the propaganda is simply unsustainable and the gears must shift. However the damage is already done and the publics anticommunism and sinophobia have already been stoked,0,15,68,-0.6369
0,vehicles escaped from the city the day before lockdown,1,131,130,0
0,Cut UK out of the Five Eyes intelligence alliance,1,1028,1924,0.25
0,China is devil,0,1162,1362,-0.6597
0,Governor Newsom Declares California A Coronavirus-Free Zone,1,715,3803,0
0,if I caught the coronavirus I would simply throw it back,1,10341,76021,0
0,the virus will be conquered soon,1,1155,1399,0
0,The main epidemic situation is only in Wuhan which is under control,1,0,25,0
0,facial mask is not effective against wuhan virus,0,150233,250874,-0.3724
0,UK has reported a case of coronavirus in Liverpool,1,0,2,0
0,Secretary Wilbur Ross says coronavirus will be good for [checks notes],1,32,118,0.4404
0,Chinas coronavirus ill help ?bring jobs back to U.S,0,230,416,-0.0258
0,It turns out u the eight people whom Chinese authorities detained in Wuhan early on for spreading untruthful information were all doctors trying to alert people to the emerging coronavirus threat. Again censorship over public welfare,0,1017,1513,-0.5994
