veracity,content,sentiment,retweet numbers,likes numbers,compound
1,My reaction to the Presidents address thoughts on the economic impact of the and some en the ground ?observations from Italy,1,102,386,0
1,This virus is on the campaign trail of a lifetime. Lowering airline and gas prices?Giving people paid leave from work? Making college campuses revert to online classes for a month? Corona is tryna secure your vote,1,59315,232228,0.1877
1,Idc what no one says this nigga know how to make some bread,0,8283,36605,-0.296
1,Pay attention and be informed. Ignorance is not bliss. We can dig deeper and respond smarter to contain . Praying for those who been infected and imploring organizations schools and institutions to exhibit compassion and concern for employees and students,0,433,1852,-0.1526
1,So it looks like Donovan Mitchell got the corona shit too,0,0,0,-0.2111
1,Your family and you will not be touch by Coronavirus,1,48654,131192,0
1,if you thankful Donald Trump is in charge tonight during this China Virus outbreak and NOT Joe Biden,1,438,670,0.5719
1,Despite the global fears of coronavirus more than people who contracted the disease have recovered. Most have mild symptoms and rebound within two weeks while those with more serious ailments may not improve for up to six weeks,0,7349,10500,-0.1697
1,I understand the Chinese government hates the label Wuhan Virus so us all Im going to call it from now on,0,6310,21040,-0.4404
1,in light of recent news re: covid-19/coronavirus outbreaks all over the world please do take your hygiene and health seriously! heres a short informative thread on how to keep yourself and your loved ones safe from the pandemic:,1,51,135,0.8268
1,Australia now has drive-thru coronavirus testing. South Korea has it. Germany has it. What the hell is happening in America?,0,14896,33850,-0.6808
1,They canceled E3 cause they know some unhygienic gamers woulda been in there smelling like spoiled deli meat and corona would have evolved into the T-Virus in u environment. Smart move,1,26856,111204,0.6369
1,BREAKING: Canadian Prime Minister Justin Trudeau will self-isolate and work from home as his wife is being tested for coronavirus,1,2770,4262,0
1,Currently taking a break from Fortnite. With whats going on in the world right now with this COVID-19 or Coronavirus disease I cant risk sitting in a bus with complete strangers from random places. I l let you know what I decide to do next hopefully this gets fixed,1,1764,23844,0.5445
1,feel like every social circle right now has someone who has read all the coronavirus news out of China and Korea and Italy and knows whats coming and theyre in charge of gently explaining things to all their friends who heard a bad flu three weeks ago and checked out,1,10543,95005,0.3612
1,Were all democratic socialists in a pandemic,1,3027,28333,0
1,Basically saying ARMYs are more effective than the condom your parents used. Interesting,1,7287,38445,0.7264
1,Tom Hanks had a cold or so he thought. In the U.S. those symptoms may not be enough to get tested for the coronavirus. But in Australia testing is free and widely available thanks to early and coordinated planning for a pandemic,1,28002,104457,0.8519
1,As of am March a total of people have been tested: negative positive patients who tested positive for coronavirus have sadly died. The digital dashboard will be updated later today,0,1634,2159,-0.4404
1,Me breaking quarantine and coming to work with u Corona V since my job wont let us work from home,1,98,179,0
1,SB19 postpones concert fan meet over COVID-19 concerns,1,998,2144,0.0516
1,Hundreds of hungry monkeys swarm across Thai street as rival gangs fight over food after tourists who normally feed them stay away because of coronavirus,0,45,137,-0.3818
1,We are open for business and have no current plans to cancel any events. Our top priority is to ensure the health and safety of customers and staff and we will continue to follow Government advice on Coronavirus. If the situation changes we will notify all affected customers,1,9,36,0.34
1,Scientists in Senegal have partnered with a UK lab to develop a hand-held coronavirus test kit u can produce results within minutes,1,2805,4604,0
1,so far . World War rumors . Corona Virus . Kobe Bryants death . Asteroid discovered heading towards earth . Tom Hanks has coronavirus . The NBA Season is cancelled,0,63308,191439,-0.8768
1,This aint Corona. This them Popeyes chicken sandwiches finally digesting,1,52547,246765,0
1,The European travel ban of realDonaldTrump is really stupid. ?9 can infect an American in France an Italian in Japan or anyone in the UK & this ban wouldnt stop them from entering US,0,1478,3519,-0.8751
1,testing must be made free to the public if we are going to understand the scope of this crisis. Anything less will undermine Americas effort to protect our communities and save lives,1,12654,27599,0.3189
1,I am covered in the blood of Jesus. This corona wont touch me,1,15561,41706,0
1,Coronavirus needs to be gone by July. Theres summer holidays u need attending,1,54584,252820,0.3818
1,twitter coming together to find the cure for coronavirus after it infected tom hanks,0,25399,112985,-0.4939
1,CNN International: Authorities in Beijing have cancelled all large-scale Chinese New Year celebrations in an effort to contain the growing spread of Wuhan Coronavirus,0,1220,2586,-0.0772
1,This is outrageous. We are in the midst of a pandemic and Senate Republicans blocked paid sick leave for those affected by the coronavirus. Congress must take action immediately to help working families,0,15161,44150,-0.7579
1,The University is % protected from COVID-19 thanks to Duo Two-Factor Authorization,1,20263,132114,0.7003
1,Coronavirus is up in the first quarter,1,584,2931,0
1,maybe ur not scared of coronavirus but u should be scared about passing it on to ppl you know who are at risk. us not just old people - its ppl with asthma ppl who smoke ppl who have underlying health problems (aka a lot more people than you think),0,143838,582006,-0.3374
1,Nancy Pelosi tells reporters to bow to each other eastern style to avoid catching the Corona Virus,0,141,157,-0.296
1,We regret to inform u u we need to cancel our team building dis coming March due to da COVID threatening. We apologize for the inconveniences but safety is utmost important. Further updates will be posted once we have set a new sched,1,6,16,0.3612
1,Its not like he called it the Ching Chong Prague you drunken camel-faced spit machine,0,9751,42598,-0.2755
1,President Trump has officially said he will use the Stafford Act to fund some of the coronavirus efforts. What is this fund u has up to $42.6 billion? Read this for details as well as for updates on how the WH and Congress are handling the outbreak,1,37,57,0.2732
1,I understand why Communist China wants to avoid responsibility for unleashing the Wuhan Virus on the world and mismanaging it as it spread but unseemly u some American politicians and media figures are supporting Chinas disinformation campaign,1,8976,24789,0.5023
1,Coronavirus is everywhere. BOOK u FLIGHT. Take u trip. You probably wont die from it but even if you do... You wanna die with the Eiffel Tower in the background or you wanna die with I-20 in the background? You decide,1,136091,716343,0.8888
1,The guy standing to Trumps left just tested positive for coronavirus according to Brazilian media. Fabio Wajngarten posted this photo taken during meetings at Mar-a-Lago five days ago,1,6273,12334,0.5574
1,Ya Allah Karam kar. May Allah keep all of us safe and healthy. Ameen,1,0,1,0.6808
1,McConnell ally says Senate wont take up House bill until after recess. He Senate will act when we come back and we have a clearer idea of what extra steps we need to take ?Sen. Lamar Alexander told reporters,1,6211,8482,0
1,Coronavirus is canceling everything but my fucking bills,1,6626,21629,0
1,Viruses dont have nationalities,1,9449,23113,0
1,The Senate is going to go into a full recess without taking action as the coronavirus is spreading at lightening speed. Tells you all you need to know about the priorities of senatemajldr & his cronies,1,1776,4663,0
1,Corona will not touch you. Say amen,1,22262,53646,0
1,I have seen a lot of random coronavirus-related stories but I did not see monkey gang war coming,0,56694,143106,-0.7469
1,Im just throwing this out there as a year old renter who supports a family of on income; if mortgages can be suspended during Coronavirus but landlords continue to collect rent (thereby *making money* from this) I WILL RIOT,0,9486,68006,-0.8074
1,no coronavirus formed against me and my family shall prosper.. like really though,1,37259,92152,0.0772
1,I was a bartender for almost yrs if it snowed on a Sat night u could be a third of your weekly income gone. is so much worse. The Congress needs to pass a stimulus for workers - not investors. Rent medical food. They need to start planning for it now,0,243,807,-0.5233
1,Chinas contagious killer virus comes to the US: American man in his s is hospitalized in Washington state with SARS-like coronavirus after visiting Wuhan CDC says,0,56,56,-0.7717
1,The United States has its first confirmed case of a new virus u appeared in Wuhan China last month the US Centers for Disease Control and Prevention announced. The virus has already sickened hundreds and killed six people in Asia,0,357,436,-0.7351
1,the virus can spread to others up to feet away? Flu viruses spread mainly by droplets made when people with flu cough sneeze or talk. Staying home and keeping your distance from others if you have flu is the best way to protect others,1,84,0,0
1,The US Centers for Disease Control and Prevention is expected to announce this afternoon u the first case of Wuhan coronavirus has been reported in the United States in Washington state a federal source outside the CDC tells CNN,1,699,537,0.4215
1,CDC has activated its emergency operations center. They expect more US cases.,0,265,611,-0.3818
1,CDC has been proactively preparing for the possible introduction of -nCoV in the US in a traveler from Wuhan including on Jan alerting clinicians to watch for this new virus & on Jan providing more guidance to public health partners,1,1273,1098,0
1,First coronavirus case confirmed in US: CDC,1,0,0,0
1,JUST IN: The first US case of the deadly Wuhan coronavirus in Washington state is expected to be announced later today by the CDC,1,370,407,0
1,NEWS: A U .S. citizen who recently returned from a trip to China has been diagnosed with coronavirus making it the first case of the new virus in the country,1,188,253,0
1,BREAKING from CNN - CDC expected to announce first U.S. case of Wuhan Coronavirus this afternoon cnnhealth,1,14,24,0
1,An individual traveling from China has been diagnosed in Washington State with the coronavirus a CDC spokesman has confirmed,1,0,0,0
1,The U.S. Centers for Disease Control (CDC) confirmed it had diagnosed the first case of the newly-identified Wuhan coronavirus in the Unites States a day after the agency concluded the potentially deadly illness can be transmitted person-to-person,0,88,70,-0.4019
1,A man who lives in Snohomish County Washington is confirmed to have the first US case of Wuhan coronavirus,1,1002,1058,0
1,The statistics for accidental shootings are so low the CDC doesnt even have those numbers but it reports accidental shooting deaths at about a year. There are million dog bites each year,0,186,1283,-0.355
1,CDC to announce first US case of Chinese coronavirus,1,35,29,0
1,First case of Chinas coronavirus confirmed in the US per CDCs Nancy Messonnier. The patient is a man in his s in a county north of Seattle who received treatment quickly. The risk to the public from this one case is low health officials says,0,6,2,-0.4939
1,has confirmed the first case of the patient is now under observation in Washington state. This mysterious coronavirus has already claimed at least six lives in China,1,26,16,0
1,Chinese authorities say the outbreak began in a seafood and live-animal market in the city of Wuhan. The Washington state patient a man in his s had traveled to Wuhan but says he did not visit the market in question or know anyone who had the virus,1,106,108,0
1,we keep spreading the facts so you to kids. Vaping isnt safe. Sincerely All Of Us. Create your own message at,0,0,2,-0.4329
1,A new virus spreading in China has been detected in Seattle says the CDC ?making it the st U.S. case. ?Health officials confirmed the virus is contagious ?It has infected ~300 people and killed in China ?Cases also in Japan Thailand Taiwan South Korea,0,746,683,-0.9013
1,BREAKING NEWS: Murphy signs anti-vaping bill based on lies & misinformation. CDC data shows % teens did NOT name flavors as a reason for trying vapor products so flavor ban is pointless! Just remember being first doesnt mean being right,0,157,225,-0.8508
1,BREAKING: First confirmed case of the new coronavirus has been reported in Washington state CDC says,1,379,287,0
1,CDC confirms first US case of coronavirus u has killed in China,0,0,0,-0.6705
1,The US Centers for Disease Control and Prevention is expected to announce this afternoon u the first case of Wuhan coronavirus has been reported in the United States in Washington state,1,699,537,0.4215
1,Read this excellent piece by former CDC director DrTomFrieden on key questions about the novel coronavirus in Wuhan China,1,22,28,0.7184
1,Handwashing is one of the most effective ways to prevent the spread of germs. Find out how to wash your hands the right way to protect yourself from getting sick,1,69,74,0.4201
1,On Tuesday the first case of the disease was confirmed in the US a man in his s in Washington state by the CDC,1,170,215,0
1,Its too early to know if has peaked but as long as flu is still spreading in your area a vaccine is the best way to reduce your risk of flu. If you do get sick with flu can treat flu and prevent serious complications:,0,45,49,-0.8922
1,CDC announces case of deadly China virus in Washington state,1,3,1,0
1,Floridas Republican U.S. SenRickScott warns CDC director to not trust China to be truthful about outbreak of deadly coronavirus and calls for high alert,1,48,138,0.2728
1,China deaths rise to with infections. Japan Korea Thailand Taiwan,1,67,87,0
1,More people have died in Parchman than from vaping. CDC where are you? Nationwide ban anyone? Some sort of coordinated nation-wide response? No? Anybody,0,172,372,-0.8915
1,CORONAVIRUS UPDATE: Chinese city of Wuhan shuts down all outbound flights and trains after virus kills . No one will be allowed to leave the city after a.m. local time,0,211,235,-0.7096
1,First Patient With Wuhan Coronavirus Is Identified in the U.S,1,403,1480,0
1,A California woman can no longer speak or care for herself after using a skin-lightening cream u contained toxic mercury according to a case report,1,35,36,0.25
1,The -nCoV outbreak first identified in Wuhan China is an emerging rapidly evolving situation. CDC is providing updated information as it becomes available,1,371,346,0
1,How would anyone know unless there was already a sample of it in an existed CDC database? Nature has every predator including very small ones. Spanish flu years ago for example. Nature can be lethal all on its own,0,246,612,-0.3818
1,I am not one to believe in conspiracy theories but I am pretty sure Tamiflu (for outpatient use) is one of the most successful scams ever pulled. The evidence does speak for itself (more side effects than benefits) but nobody can hear it because Roche pays the CDC to speak louder,1,92,521,0.7246
1,Feds & Big Pharma Push to Force States to Mandate ALL CDC Recommended Vaccines,1,0,0,0.2023
1,As the epidemic continues to affect the city and surrounding regions and countries I talked to cbcradios evening current affairs show cbcasithappens about how people are feeling on the ground and what led to the current outbreak including handling,1,1,5,0.128
1,Inside Wuhan airport people are queueing for flight check-ins. In the early morning the local authorities announced to suspend the citys public transportations from Jan am,0,212,235,-0.3182
1,Local media StandNewsHK reveals u the first case of has been confirmed this afternoon and u he travelled to Hong kong using the high-speed rail. And the patient is being hospitalised at Queen Elizabeth Hospital,1,551,441,0
1,Caixin removed its paywall for all related articles in Chinese publishing a series of reports on the ground from Wuhan and Guangzhou WHO conference in Geneva expert interviews in Hong Kong and Washington DC. It has done a huge service to the public,1,82,284,0.3182
1,MRT stations in start to run alert about reminding passengers to wash their hands and wear masks. More and more passengers are following the protocol now,1,10,29,0.296
1,On as soon as the govt loosened info censorship Chinese media such as Caixin & Beijing News?have had the best coverage way more in-depth and ahead of any int outlets. Imagine how vibrant the Chinese media scene would be if only theres no censorship,1,567,1588,0.7506
1,International researchers have found u bats are a natural host of coronaviruses. Say is from coronavirus family like and the host is probably the same. And ppl is putting bats on their dining table,1,594,604,0.6124
1,Someone sent me this menu from . Seems pretty awful people are STILL eating this stuff potentially putting half the planets population at risk from .,0,87,102,-0.2263
1,According to the own data last seasons had a NEGATIVE effectiveness for adults aged to indicating higher odds of influenza among vaccinated compared with unvaccinated patients,0,377,452,-0.6633
1,TRUTH IN POLICY MAKING: Flavor bans are based on claim u flavors are the driving factor for teen experimentation. CDC data clearly shows this is not true. Notably teen vaping was down in but curiosity spiked between with media coverage of ANTZ moral panic.,0,58,78,-0.5022
1,As everyone has a mild freak out about coronavirus its worth pointing out u the CDC says people have died from the flu so far this year and between million and million people have been infected by the flu virus,0,211,406,-0.9186
1,Breaking: The CDC is expected to announce the first case of the new strain of coronavirus or nCov in Washington state in the United States,1,186,175,0.3818
1,WHO recommendations to reduce risk of transmission of emerging pathogens from animals to humans in live animal markets,0,56,85,-0.2732
1,New York City Puerto Rico and states are still experiencing high levels of -like-illness,1,178,155,0
1,Washington Gov. Jay Inslee on first confirmed case of coronavirus reported in U.S.: The risk is low to residents of the state of Washington.This is certainly not a moment for panic or high anxiety. It is a moment for vigilance.,1,694,1711,0.0521
1,with over million people will shut down all its public transportation (including airports) on Jan am. has kept saying u everything is under control with do you trust this totalitarian gov with you life,0,278,252,-0.0836
1,Symptoms of -nCoV include:A fever Dry cough Shortness of breath Trouble breathing,0,108,156,-0.4019
1,THREAD: The death toll from the new coronavirus outbreak in China is rising rapidly and there are hundreds of confirmed cases. Here are some of the key things to watch out for as the situation unfolds,0,74,56,-0.5994
1,with over million people will shut down all its public transportation (including airports) on Jan am. has kept saying u everything is under control with,1,278,252,0
1,PLA forced quarantine in Wuhan now,0,196,213,-0.4588
1,Tianhe International Airport is now closed by the government as an attempt to contain the outbreak,1,115,147,0
1,individuals are being tested for the Wuhan coronavirus in Quebec City and Montreal after travelling to Wuhan and showing symptoms of a respiratory virus,1,17,16,0
1,A biosafety level laboratory u studies the worlds most dangerous pathogens ?is based in Wuhan the epicenter of the coronavirus outbreak in China leading some to claim u the virus could have accidentally escaped the lab,0,1723,3200,-0.6997
1,As reports come in u the Chinese authorities have been covering up the scale of the outbreak in Wuhan so do the first videos of people dropping like flies. million people have been quarantined and prevented from travelling... but millions already have,1,1723,3200,0.2023
1,Me seeing the doomsday clock going to a seconds Australia on fire and the coronavirus all trending on the same day,0,1640,5792,-0.7351
1,China Lockdown Extends to Five Cities Million People over Wuhan Virus,1,0,0,0.128
1,Did anyone notice u just quarantined million people by confining them to three cities to contain the outbreak of a new ? Sounds like the opening scene of a movie..,1,114,244,0.3612
1,Chinese authorities ?control of information has been amazingly effective. Last week when I spoke to friends in Wuhan about they dismissed what I said as fake news. Now they are trapped in the city a giant cage guarded by policemen and soldiers,0,6,10,-0.0018
1,A man is being treated for symptoms associated with at the Royal Victoria Hospital in,1,18,5,0
1,BREAKING: Beijing has cancelled Chinese New Year celebrations due to the outbreak of the Wuhan virus,0,339,421,-0.25
1,Breaking: The following cities in China are on lockdown to prevent the spread of nCov or novel coronavirus: Wuhan Huanggang Ezhou Zhijiang Qianjiang Chibi Xiantao. Over million people in total are under lockdown orders,1,184,194,0.34
1,Stocks around the world slumped Thursday as China locked down two more cities to try to contain the coronavirus outbreak,1,46,60,0
1,BREAKING: Singapore and Macau just confirmed their first case of the novel (2019-ncoV),1,574,677,0.3182
1,The U.S. will begin ?at JFK LAX and SFO ?screening passengers who are traveling from Wuhan China for a virus u has caused a pneumonia outbreak in u city. The CDC says at this moment the risk of infection to the general American public is low,0,372,505,-0.5514
1,The Real Umbrella Corp: Wuhan Ultra Biohazard Lab Was Studying The Worlds Most Dangerous Pathogens | Zero Hedge,0,71,71,-0.5256
1,A World Health Organization emergency committee decides it is too early to declare the Wuhan coronavirus a public health emergency of international concern,0,242,435,-0.6369
1,This deadly was spread fr (China) to many countries just in days and kill ppl. Maybe thousand ppl carrying pathogens are traveling around the world Its spread fr human to human via air and still have no vaccines Pls read it & reduce the risk of infection,0,1371,1424,-0.8271
1,Wuhan Coronavirus blamed on bat soup as pics emerge of people eating the Chinese delicacy,0,499,743,-0.4767
1,I am in Singapore more than kilometers away from Wuhan and am trying to get face masks for our trip back to Beijing. Asked at five shops and they are all sold out,1,17,63,0
1,China confirms st death outside Wuhan from new coronavirus outbreak. Death of man near Beijing brings death toll to with others infected. City of Xianning adjacent to Wuhan also placed under quarantine; total number of people affected rises to more than million,0,33,25,-0.9451
1,NEWS ALERT: The Brazos County Health District is investigating a suspected case of the Novel Coronavirus,1,33,51,0.516
1,dead. were in China. Coronavirus not yet emergency outside China,0,53,43,-0.4795
1,CCP bots are now attacking my tweets with disinfo u the US created the Wuhan virus as a biological attack on China,0,295,878,-0.6249
1,So far cases of the Wuhan coronavirus have been confirmed in mainland China including deaths,1,353,379,0
1,China has shut down the Great Wall as the Wuhan Virus Outbreak spreads,1,334,447,0.6249
1,A screengrab of a video posted by the same person (left) and a Xinjingbao photo about Wuhans quarantine measures taken at Red Cross Hospital,1,2504,2086,0
1,Disturbing Leaked Video shows People literally falling over as they succumb to Virus. cities million people have now been quarantined. case found outside quarantine area This Morning,0,12265,8464,-0.7351
1,Wuhan is the latest crisis to face Chinas Xi and its exposing major flaws in his model of control,0,15,33,-0.7351
1,Among the sites closed in China due to Wuhan coronavirus: ?The Forbidden City ?A section of the Great Wall of China ?Shanghai Disney Resort ?McDonalds restaurants in five cities ?The Birds Nest stadium ?National Museum of China,1,193,330,0.504
1,did something similar during SARS outbreak in . Beijing built hospital in days. Wuhan hospital being built with pre-fab parts and aims to keep patients isolated with pooled medical resources state media says,0,33,90,-0.3182
1,If I read this right the internet traffic from is down %. As people cant stay out or travel one would expect the internet connectivity to go up and not down? Either communications are disrupted or Million people gradually dropped offline?,0,71,133,-0.2168
1,Huge Was just told by a Chinese reporter u CCP authorities are allowing disinformation to spread on social media to downplay to the full extent of the Wuhan virus outbreak,1,1152,1946,0.3182
1,Hospitals in over everwhelmed ?due to the and a -bed mobile hospital reportedly will be built in (the epicenter) within days(!). Unfortunately this outbreak will get worse (likely MUCH worse) before it gets better,0,224,338,-0.4389
1,Its the history the the deleted posts the appeared activists and journalists the arrested citizens who spread the news the system u makes people of Wuhan being scared of speaking out and just trying to save themselves and their families,0,21,69,-0.4215
1,Wuhan doctors cited in Chinese media reports now say u fever fatigue and cough are now not the only first signs of coronavirus infection. Other symptoms include - nausea vomiting diarrhoea headaches chest tightness muscle soreness and even conjunctivitis,0,301,227,-0.25
