veracity,content,sentiment,retweet numbers,likes numbers,compound
0,The impact on Chinas holiday economy from must be epic,1,491,786,0.4019
0,In China built a laboratory to study the Corona and Ebola virus in Wuhan and US biosafety experts warned u the virus might leak from the facility,0,6004,5825,-0.5423
0,Virus-hit Wuhan has two laboratories linked to Chinese bio-warfare program - Washington Times,1,0,0,0
0,Drugs often used to combat HIV and AIDS are being used to treat patients of the Wuhan coronavirus in Beijing,1,340,576,0.0772
0,China BLOCKS UK from airlifting hundreds of Brits trapped in coronavirus-plagued Wuhan,0,1,0,-0.7213
0,CCP has launched propaganda campaign globally to say Snakes Bats & Sea Food responsible for to deflect attention from the real culprit i.e. Biological Warfare programme in Wuhan from where this virus got leaked,0,181,311,-0.4019
0,Corona virus is manmade,1,504,880,0
0,Confirmed there are kits on the way to Wuhan. We dont have the real numbers because they are overwhelmed and cannot test everyone,1,19,88,0.0516
0,Sen kikopangilinan urges the government to impose a preemptive ban of visitors from Wuhan China,0,19,88,-0.7003
0,The state of California has declared u they are well-prepared to handle the if cases would appear in the state,1,1344,2185,0
0,Today is Day (higher than u) of the Wuhan Coronavirus outbreak. The US hasnt stopped people from China from entering the US. And the WHO still hasnt declared the Coronavirus a Public Health Emergency of International Concern,0,93,241,-0.2344
0,Multiple experts estimate u the ACTUAL cases in number *tens of thousands*,1,276,393,0.0772
0,Reasons For Chinas Unreliable Death And Infected Statistics Finally Revealed-Insufficient Test Kits Also Cambodia Reports First Case,0,0,1,-0.7964
0,Million People Left Wuhan China Before Travel Restrictions Imposed,0,0,0,-0.0772
0,Wuhan Coronavirus Infections Could Be Times Higher Than Official Total,1,3,8,0
0,Peoples anger towards Wuhan and Hubei officials is through the roof,0,45,113,-0.5719
0,Officials visiting hospitals with N95 masks and doctors in flimsy regular surgical masks,1,49,56,0
0,BSL-4 Research Laboratory was using a bat-derived SARS-like to test its disinfectant procedures in . Genetic sequencing of Novel CoV suggests the current virus is extremely similar. Proximity of the Research Lab to outbreak origin deeply troubling,0,115,203,-0.3597
0,The deadly animal-borne coronavirus spreading globally may have originated in a laboratory in the city of Wuhan linked to Chinas covert biological weapons program says Israeli biological warfare analyst,0,139,179,-0.6249
0,There comes a point sometimes in the cycle of bourgeois media where the propaganda is simply unsustainable and the gears must shift. However the damage is already done and the publics anticommunism and sinophobia have already been stoked,0,15,68,-0.6369
0,vehicles escaped from the city the day before lockdown,1,131,130,0
0,Cut UK out of the Five Eyes intelligence alliance,1,1028,1924,0.25
0,China is devil,0,1162,1362,-0.6597
0,Governor Newsom Declares California A Coronavirus-Free Zone,1,715,3803,0
0,if I caught the coronavirus I would simply throw it back,1,10341,76021,0
0,the virus will be conquered soon,1,1155,1399,0
0,The main epidemic situation is only in Wuhan which is under control,1,0,25,0
0,facial mask is not effective against wuhan virus,0,150233,250874,-0.3724
0,UK has reported a case of coronavirus in Liverpool,1,0,2,0
0,Secretary Wilbur Ross says coronavirus will be good for [checks notes],1,32,118,0.4404
0,Chinas coronavirus ill help ?bring jobs back to U.S,0,230,416,-0.0258
0,It turns out u the eight people whom Chinese authorities detained in Wuhan early on for spreading untruthful information were all doctors trying to alert people to the emerging coronavirus threat. Again censorship over public welfare,0,1017,1513,-0.5994
0,A deadly virus has infected million Americans so far. Its not coronavirus,0,5,7,-0.4939
0,coronavirus is good for America,1,237,987,0.4404
0,Due to the Coronavirus Outbreak These Travel Brands Have Suspended or Altered Service to China,0,1,1,-0.4767
0,Coronavirus is scary enough to make Americans racist about Chinese people but not scary enough to make Americans start washing their hands,0,19807,83355,-0.836
0,Most of the estimated or so Americans in Wuhan were not given a seat on the one plane sent by the U.S. government to evacuate diplomatic staff and some private citizens. Others did not want to leave their partners children or pets behind,0,6,3,-0.0191
0,CDC is committed to protecting the health & safety of all Americans. We continue to believe the immediate risk to the larger American public is low at this time,1,91,198,0.1779
0,Breaking News: The U.S. temporarily barred foreigners who visited China as markets had their worst day in months over coronavirus fears,0,143,215,-0.7845
0,Yet to be confirmed report says a guy with has been quarantined in Brittania hospital Lekki Lagos State,1,204,356,0
0,Countries are requested to provide protective suits and other medical resources before evacuating citizens,1,282,403,0
0,Chinese health officials are treating the Wuhan coronavirus using HIV medications,1,10,14,0
0,So far theyve quarantined million people in China,1,966,1881,0
0,coronavirus not killer disease,1,15,42,0.5334
0,China says it needs medical masks urgently,1,1128,3698,0
0,Some hospitals in Wuhan have refused to accept patients because medical staff are infected Chinas major media do not report the true condition of hospitals at all,0,391,547,-0.6288
0,All we can do is wear mask drink lots of water wash/sanitize hands and eat healthy foods,1,62,408,0.4019
0,Please send Wuhan plague at Israeli military,1,1347,1571,0.3182
0,JUST IN: Macau the worlds biggest gambling hub has not asked casinos to temporarily close to halt the spread of coronavirus,1,298,299,0
0,The death toll in China stands at exceeding the mainland fatalities from of,0,3,23,-0.8316
0,Wuhan coronavirus: Confirmed cases top as China marks deadliest day ?CNN,1,0,0,0.2023
0,staying healthy onboard cruise ships,1,2,17,0.4019
0,situation report,1,106,184,0
0,Du30 & the Philippine government is handling the NCOV situation perfectly well,1,87,411,0.743
0,CCP China bans all travel for New Year Festival to better protect citizens,1,196,187,0.8271
0,Putting millions of people into concentration camp just because they chose to believe in different God than you,1,44567,46003,0.2732
0,Cerberus (Pluto) - Infested Outbreak - Goal: - Rewards: Corpus: Mutagen Mass,1,0,0,0.4767
0,McConnell agrees u there is a bull in the china shop,1,0,0,0.2023
0,Chinas Tencent Accidentally Leak The True Terrifying Coronavirus Statistics,0,24,61,-0.6908
0,he streets [of Wuhan] are empty... the shelves in the supermarket are empty,0,176,378,-0.2023
0,NYC is investigating two new possible cases. Both patients have symptoms and were recently in China,1,21,23,0
0,Tencent may have accidentally leaked real data on Wuhan virus deathsTencent briefly lists infections and deaths from Wuhan coronavirus,0,371,707,-0.5719
0,we only have cases of nCoV,1,41,0,0
0,mickey has coronavirus,1,737,3194,0
0,The US Fast-Tracked a Coronavirus Test to Speed Up Diagnoses,1,0,4,0
0,The coronavirus seems to attack the nerves or the brain,0,53,52,-0.5423
0,more people being tested for in . samples now sent to CDC,1,2,7,0
0,Turkey is utilizing the chaos to its benefit,0,0,1,-0.1779
0,Chinese Doctor Who Raised Alarm on Coronavirus Dies in Hospital,0,24,15,-0.34
0,ncov is everywhere,1,1,11,0
0,The death of a doctor who was reprimanded for warning about Chinas virus triggers an outpouring of praise for him and fury u communist authorities put politics above public safety,0,4,4,-0.5574
0,Millions of poor farmers and workers will lose access to a cheap and easy way to buy and sell fresh food if Asian cities clamp down on traditional wet markets in the wake of the deadly,0,9,29,-0.1531
0,Last week one of Harvards most prominent scientists was arrested. He is a participant in Chinas Thousand Talents recruitment program an initiative u prosecutors say has been weaponized to steal trade secrets,0,412,409,-0.1796
0,Concerns coronavirus is going undetected in Indonesia,1,44,73,0
0,Nothing to do with viruses! China is no longer suitable for human life they were forced to sing the national anthem by underworld,0,257,263,-0.6696
0,Many Hong Kong residents have little confidence in their governments ability to handle a crisis,1,481,503,0.0534
0,NCoV No Casama on Valentines,0,6653,19516,-0.296
0,The coronavirus ban has plunged Asia tourism into a challenging period but the outlook needs not be bleak if industry players take the opportunity to reduce their reliance on a single market,1,0,0,0.4019
0,Coronavirus: journalist missing in Wuhan as anger towards Chinese authorities grows,0,168,243,-0.7096
0,China has never opened its own market to competition from ericsson nokia in terms of G prime contractor status. Nor has China provided clear explanations as to the level of state support for H ?,1,76,72,0.6486
0,. : The number of confirmed cases in China crossed the mark on Feb. increasing cases to . Every days at this point another confirmed cases are being added. Feb. - K Feb. - K Feb. - K,1,260,326,0.0772
0,The death toll from Chinas coronavirus outbreak has risen to more than as plans to restart the worlds second-largest economy on Monday faltered,0,120,165,-0.5994
0,Those folk in China are just inhumane,1,417,374,0
0,Official death toll over but we all know those figures are being watered down,0,2,1,-0.3506
0,Over the weekend major cities such as and have joined a list of over cities u have enacted isolation measures to prevent the from spreading,0,167,135,-0.3818
0,China slowly returns to work as coronavirus toll hits daily record,1,28,49,0
0,North Carolina health officials said four people who recently returned to Charlotte from China are being monitored for coronavirus symptoms,1,26,39,0
0,China Powers Down Bitcoin Mining Farms Amidst Coronavirus Scare,0,98,1335,-0.4939
0,Some other weird virus circulating in Nigeria,0,9,5,-0.1779
0,No better way to understand how we ended up in this mess...than by looking at this poll,1,587,1482,0.1779
0,The UK held a second evacuation of British families from Wuhan while Chinas efforts to revive its economy fell short on Monday as markets across the region sank,1,14,19,0.34
0,As the third term of the academic year starts concerns on the Novel Coronavirus arise,1,16,25,0.3182
0,The death toll from the novel coronavirus surged past in mainland China on Sunday overtaking global fatalities in the SARS epidemic even as the World Health Organization said the outbreak appeared to be stabilising,0,415,368,-0.7579
0,Possible scenario.....NZ has a sudden virus outbreak. People get a knock on the door in the middle of the day dragged out to a waiting van,0,0,2,-0.0516
0,No occasion for panicNewspaper in trying to downplay the Spanish Flu which ended up killing million people,0,342,584,-0.8481
0,the number of Chinese people in Britain with confirmed cases of coronavirus is still fewer than the number of Chinese people doing comedy so if you see a Chinese person on the tube and assume they are a comedian u would be statistically less racist,1,8349,42040,0.2484
0,Since the question of investments into pandemic vaccines came up here recently. Will the hundreds of billions of economic losses caused by nCoV now be an incentive for countries to maybe invest a few billion $ into pre-pandemic vaccines and production infrastructure,0,29,128,-0.0516
0,the number of Chinese people in Britain with confirmed cases of coronavirus is still fewer than the number of Chinese people doing comedy so if you see a Chinese person on the tube and ass,0,8349,42040,-0.1027
0,the days quarantine be extended,1,60,140,0
0,Heads getting shaved. A team of medical workers from Gansu province being sent to help,1,61,72,0.4019
0,Hackers are leveraging the fears surrounding Coronavirus in order to carry out cyber attacks on a massive scale,0,12,0,-0.6908
0,Craziest coronavirus stat I seen: Hong Kong visitors per day plummets from to fewer than,0,47,136,-0.0516
0,Theirs this malayalam movie called virus released in IMDb (8.1) It is based true events of nipah virus outbreak in the Kozhikode district of the Kerala state in INDIA During may,1,0,2,0.4215
0,The number of new cases from Chinas coronavirus epidemic dropped for a third consecutive day but global concern remains high about its spread,1,0,0,0.0387
0,Due to the outbreak of Novel Coronavirus MCountdown will be recorded with NO audience for a period of time for Pre recording as well as live show in order to prevent further spreading of the virus,1,413,1964,0.1449
0,Chinese President Xi Jinping for ignorant or stupid policy in dealing Wuhan city virus break,0,1400,2858,-0.6705
0,cases of espionage with Chinese spies infiltrating the State Department CIA and DIA,1,2,11,0
0,the coronavirus is an engineered bioweapon,1,842,1896,0
0,Theres nothing semi-corrupt about this,1,396,432,0
0,supermarkets shown completely empty as panic ensues over the spread of the deadly,0,80,126,-0.6865
0,Analysia is also ranked above Singapore Thailand and South Korea as being most prepared for major infectious disease outbreaks,1,1996,2649,0.2944
0,People being affected by the in some part of China are being moved to Wuhan due to lack of Medical attentions,0,18,42,-0.4404
0,Wuhan seafood market may not be source of novel virus spreading globally,1,27,47,0.3182
0,patients were admitted to San Lazaro Hospital and of them are Chinese nationals from Wuhan,1,1204,919,0.1027
0,UK loses track of Chinese visitors who flew there from Wuhan,0,95,0,-0.3182
0,China reports u deaths from rise by to and the number of confirmed cases rise by to . Its hard to discern how much their reporting on new cases is still being skewed by their fixed and limited testing capacity,0,358,711,-0.25
0,Of people on board the Diamond Princess tested for the new coronavirus are confirmed to have it,1,342,386,0.34
0,With deaths and victims of Corona virus one fact has been overlooked,0,392,1654,-0.34
0,There are newly confirmed coronavirus cases aboard the Diamond Princess ship docked in Yokohama Japan,1,439,429,0.3612
0,Wuhan should been locked down earlier a resident says adding u the government has become more open but here must have been a cover-up before ?SCMP News7:39 AM ?Jan,0,71,105,-0.4871
0,This charge u the spread the --see below--illustrates how claims although ludicrous are dangerous. ?Gordon G. Chang1:52 AM ?Feb,0,373,630,-0.7149
0,Up to two weeks of incubation time during which you are contagious yet show no symptoms We also see u our governments are unprepared. No quarantine no beds no hazmat suits not enough medical equipment ?BasedPoland8:32 PM?Jan,0,414,681,-0.8611
0,We were giving a false sense of assurance. ?,1,612,664,0.5859
0,She is a doctor in Wuhan... If she quit. The local government will revoke her doctor ?,1,10389,3782,0
0,Virologist Who Visited Wuhan Says Coronavirus is out of Control ?,1,2498,13579,0
0,Despicable! Celebrating the lethal virus! Based on belief u only Chinese will die! Commerce secretary says deadly coronavirus could be good for America ?,1,622,619,0.5538
0,Breaking: China has released Q1 GDP coming it at a healthy % on increased in medical supply manufacturing including machinery as well as increased demand for health care services ?,1,34,170,0.8658
0,This statement is the epitome of the Republican party. Unless it affects them personally or their family it is not taken seriously and called fake news. Right-wing media called Covid-19 a prank perpetuated by the Democrats. GOP HouseGOP SenateGOP GOPChairwoman,1,4834,18802,0.0305
0,A man coughs on a bus. The whole bus is looking at him. Conductor: Do you have a coronavirus? Man: No what are you? I have tuberculosis! Conductor: Well thank God,1,0,7,0.6312
0,Jkylebass I believe this is just a trial. Most likely not the deadliest virus they contain. By releasing something like corona virus they can track its outcome and plan for the real deal when they chose to release,1,0,6,0.3612
0,Kane9015 TheAngelofWrath Its one of the reasons as it turns into summer in the Northern hemisphere there will be a reduction in cases just like with flu and colds. This along with the normal plateau and tapering periods that come next (see NK + China),0,0,1,-0.0258
0,lakeith fingernails are the original cause of coronavirus,1,27,419,0.3182
0,Not to be insensitive but if youre infectrd with Corona virus you NEED to stay in the country you caught the virus from. Flying sick Americans home knowing they can infect everyone else is reckless,0,0,0,-0.8256
0,Who started the Coronavirus? Ask the DemocRATS,1,1,2,0
0,thank god corona virus doesn have a twt acc bc it would definitely had came for that social spot of bts,1,1,3,0.743
0,So Ia seeing that African blood can resist the coronavirus. Can i get a halleluYER?,1,0,1,0
0,SaudiMOH Hi Im a concerned citizen. I heard from a Saudi friend that there was a one case of novel corona virus yesterday as reported. Please confirm and announce it in public,1,0,1,0.7783
0,scorpysz ZoinksScoob13 tdsb Toronto District School Board: Cancel all TDSB schools for weeks as a precaution to the Coronavirus - Sign the Petition!,0,0,1,-0.3164
0,Hey Wuhan China. And more precisely the death lab where this bioweapon was created to extinguish humanity: Fuck you. ??,0,4,9,-0.792
0,Coronavirus vs. Flu Virus: Which Is Deadlier?: Is the novel coronavirus deadlier than this year flu season? Read on to find out.,0,0,0,-0.504
0,SF Fed President Mary Daly on CNBC: Coronavirus still a minimal impact on regional and national economy I am not looking for this to do anything material to our economy,1,9,5,0
0,NathanGrubaugh KindrachukJason COVID2019_ Power__Play Mathematically you will rule out Mars and settle on the virus research lab in Wuhan as the most probable COVID-19 hotspot putting in to consideration the kind of research they have been doing on Bat Immunity (Knock outs),1,0,0,0
0,Want to stop having people freak out about Coronavirus? Have employers threat to stop signing paychecks.,0,0,0,-0.8555
0,Coronavirus Could Survive on Surfaces for Nine Days - Alibaba Aliexpress Shipping Update-The Bizcrush,1,1,0,0
0,JooeySiiu Yet another rubbish excuse to burn! Can you have one reason to burn the estate in helping or the local residents? I am sick of it and especially you!,0,0,1,-0.3365
0,Virus-hit Wuhan has two laboratories linked to Chinese bio-warfare program,1,0,0,0
0,With the corona virus the Hong Kong protest disappeared Intentionally or coincidentally? Never doubt anything from socialism communism dictatorships ?,0,0,0,-0.2846
0,WHO I have a free suggestion Can t we kill corona virus by raising body temperature? Because when we get fever our body raises? Temperature and it kills viruses,0,0,0,-0.7399
0,Styx666Official All they got in China is powdered tiger dick and rhino horn,0,0,0,-0.5106
0,Controversial proposal for treating coronavirus in India: Of course people may still survive the infection after homeopathic treatments...but many survive with NO treatment,0,0,0,-0.5766
0,God has not ordered eating meat. Whoever it is you (-China) will have to suffer the brunt of sin and deeds unless you come to the shelter of Saint Rampal Ji Maharaj and do full devotion to the divine Kavir Dev.,1,5,5,0.1531
0,It isns racism and I\ tell you why it wouldnt matter where the epicenter is. What matters is containment it just so happens they Asian. If it happened in USA all countries would be retrieving their own and keep US OUT !!!!,0,0,0,-0.7385
0,meanwhile los chinos,1,0,0,0
0,Today is World Cancer Day as you know that the corona virus is spreading in China which is the cause of cancer if you want to get rid of diseases like cancer. Get true worship because Supreme God Kabir is most merciful Must watch sadhna channel :30pm,0,0,0,-0.4019
0,ScottMorrisonMP when are you going to force flights to cease from China? Rest of the world is but we seem to be twiddling our thumbs hoping itll just go away,1,0,0,0.5719
0,Breaking: Secret Court Covering Up The Truth About Coronavirus via YouTube,1,0,0,0.3182
0,Purell hand sanitizer does NOT kill the flu or corona virus nor kill e.Coli bacteria Buy Clorox wipes,1,1,0,0.9163
0,Lol not happening,1,0,0,0.4215
0,Countries told to learn from China in virus: WHO showing once again that it is far from an independent organization. Or at the very least that it has zero concern about in the management of . /,1,13,15,0
0,I hope coronavirus screening was put in place for attendees at the We cant compound our problems by infecting the top players in the oil industry or...nvm,1,0,0,0.7147
0,Only following food protocol can save from outbreak halalSG Joyce_Karam spectatorindex china OIC_OCI MOISaudiArabia,1,0,0,0.4939
0,CDC testing several people in US for possible Wuhan virus CDC spokesperson Kristen Nordlund says. The CDC has the only laboratory in the United States that can test for this new virus. cnnbrk,1,10,5,0.4215
0,WHO WHOWPRO WHOSEARO WHO_Europe pahowho WHOEMRO WHOAFRO Save Iraqi citizens from spread COVID19 because our goverment not close borders with Iran and they will leave us face death with disaster health system,0,0,0,-0.7184
0,Thanks for the great Art ARRE INDIA Bakth will say Modi ji is not working BJP ?????? To be honest is equal to,1,1,0,0.9054
0,PMBreakingNews cswany2 It looks like a smoke machine. China is known to overact with not too many testings. Whatever theyre spraying I hope it doesnt cause more harm than the CoronaVirus,1,0,0,0.816
0,Sat bhakti cures diseases like AIDS or cancer. By the way to avoid the corona virus satbhakti is necessary. SrBachchan PMOIndia SatlokChannel AajKamranKhan,0,4,4,-0.6249
0,Coronavirus! What really is its origin? Wuhan China has the only bio warfare facility in China. Hey! Hey! Just because Im paranoid doesnt mean they arent after me.,0,1,1,-0.6219
0,the containment effort starts to seem to be effective. Hopefully the outbreak can be entirely stopped soon even the research on the vaccine may take months.,1,0,0,0.5584
0,CN start to control the pandemic in their country and some experts said they expect to clear this out by the end of April. However there are also some information about they shutting down a lab that just announced their research about Covid-19 this is troublesome,0,0,2,-0.1779
0,Unsure whether it was the Chinese but most likely the American government that started COVid19 but one things certain it was definitely biological warfare designed to cause mass hysteria/ reduce elederly population,1,0,3,0.4404
0,__aarum Everyone knows China like to control the narrative. Its times worse than they telling us,0,0,3,-0.1531
0,Man York isnt that far from me you know what I am gonna stay indoors and hide till this all blows over,0,0,8,-0.1779
0,THEY COMPLAINING TO THEIR WHITE GOD. AS SOON AS AFRICANS ACCEPT HOW THE WORLD PERCEIVES AFRICA AND HER PEOPLE YOULL STOP BEING SHOCKED AND SURPRISED.,1,4368,11254,0.0772
0,Coronavirus will come to an end by the time summer arrives,1,1,4,0
0,ImohUmoren ochuko_atenaga Corruption is caused by coronavirus,1,2,9,0
0,TheJonasJuice Still... This shouldnt warrant a cancelation when there are other more dangerous viruses. Cancel cause the flu is deadlier this year or something like that but coronavirus??? Seems like an overreaction especially cause its foreign..,0,0,0,-0.3001
0,Wilbur Ross says Coronavirus could boost US jobs,1,1,2,0.4019
0,yaneerbaryam Ill believe it when I see it. I think this is better explained by Chinese health system being maxed out and because so many people are self quarantining across China thats going to be very hard to maintain and with an incubation period so long it wont die out and surge again,1,0,0,0.3722
0,Sind die komplett deppert? Austrian pharmacies recommend to fight ?Crazy greedy charlatans,0,0,0,-0.8426
0,US panic over reminds me of panic over . It has nothing to do with medicine or science. It has more to do with a culture of hatred based on stereotypes and fear?,0,2,17,-0.9325
0,The bad viruses always come from China ...They were just called flu before DNA was understood ...,0,0,9,-0.7269
0,Why is half of the British population panicking over bloody toilet paper and not over losing their at the end of this year? ?9,0,3,15,-0.6093
0,is now a hoax? Wow....but yeah build the wall Mexico will pay for completely,0,0,1,-0.0772
0,Lemme say something the general Media hasnt. This Coronavirus outbreak definitely is not something to absolutely freak out about like the media is. A Coronavirus is similar to the flu. The flu has killed over k people in America just last year who had weak immune systems,0,0,0,-0.8553
0,Pharmaceutical companies will get part of the billion; Executives will get part of the billion; CEOs will get part of the billion; Billionaire and Millionaire families will get part of the billion; everyday workers will get.....a tweet!,1,192,501,0
0,Coronavirus outbreak stemmed from a snake this is how u know them man are juj wa majuj they eat everything,1,0,0,0
0,ForeignPolicy BeijingPalmer china wants transparency? their brainwashed officials wont do that. their habit is to report whatever their bosses want to hear for the sake of survival. you cant change those robots overnight.,1,1,3,0.0772
0,ChangeIsGood58 peyote_radio JoeyOfTheWorld There seems to be epidemic. Imagine only one person handling press questions. Guess they have never of one person one story and stick to it. Unlike Rudy doing his own style of Hip Hop that undermines Thump,0,0,1,-0.34
0,hoopwitniyaa Chinese Billionaire claims over people died and Million are infected by Coronavirus. Watch it here:,0,0,1,-0.7783
