veracity,content,sentiment,retweet numbers,likes numbers,compound
0,WHO WHOWPRO WHOSEARO WHO_Europe pahowho WHOEMRO WHOAFRO Save Iraqi citizens from spread COVID19 because our goverment not close borders with Iran and they will leave us face death with disaster health system,0,0,0,-0.7184
0,Thanks for the great Art ARRE INDIA Bakth will say Modi ji is not working BJP ?????? To be honest is equal to,1,1,0,0.9054
0,PMBreakingNews cswany2 It looks like a smoke machine. China is known to overact with not too many testings. Whatever theyre spraying I hope it doesnt cause more harm than the CoronaVirus,1,0,0,0.816
1,(Needless to say that the significant delays in the US coronavirus response provide some contrast to the US Presidents claims that they have taken early and successful action.),1,0,0,0.6808
0,Sat bhakti cures diseases like AIDS or cancer. By the way to avoid the corona virus satbhakti is necessary. SrBachchan PMOIndia SatlokChannel AajKamranKhan,0,4,4,-0.6249
1,HonorAndDaring health minister warned that it would be foolish for of their business people in Kampala to travel to China for business. She addressed this issue sternly: We now do not have Corona Virus in Uganda.,0,0,0,-0.4939
1,Via Reuters about in,1,1,0,0
1,Trump being President is a nightmare,1,0,0,0
1,US declares virus emergency ?bans travelers from China,0,0,0,-0.3818
0,Coronavirus! What really is its origin? Wuhan China has the only bio warfare facility in China. Hey! Hey! Just because Im paranoid doesnt mean they arent after me.,0,1,1,-0.6219
0,the containment effort starts to seem to be effective. Hopefully the outbreak can be entirely stopped soon even the research on the vaccine may take months.,1,0,0,0.5584
1,These rumours about this damn wuhan virus is getting out of hand! Stop spreading and pls look into reliable sources if you want true information! ??,1,0,0,0.4971
1,M101News /4 in article they said that some virus aspects are more closer to actual transmition is at least % different than SARS while the recent studies about chinese virus shows that the virus is %-99% similar to SARS Pic study Pic -,1,0,0,0
1,Just in case whos looking for N95 / ly Medical Disposable facemask against coronavirus Amazon in Stock now!,1,0,0,0.68
1,This is dead wrong yeah they coming from China but they are all been tested prior during and after the flight for the virus and they are been coming back negative. Once here they will be placed in quarantine for about weeks no matter what for on going monitoring.,0,0,0,-0.8957
1,Good to see my state doing the right thing even if our national response is a dumpster fire.,0,0,0,-0.0258
1,Chinas virus-stricken Wuhan converts buildings into?hospitals,1,0,0,0
0,CN start to control the pandemic in their country and some experts said they expect to clear this out by the end of April. However there are also some information about they shutting down a lab that just announced their research about Covid-19 this is troublesome,0,0,2,-0.1779
1,Many kudos to the Chinese government a model of how governments should respond to emergencies like this.,1,0,2,0.7003
0,Unsure whether it was the Chinese but most likely the American government that started COVid19 but one things certain it was definitely biological warfare designed to cause mass hysteria/ reduce elederly population,1,0,3,0.4404
0,__aarum Everyone knows China like to control the narrative. Its times worse than they telling us,0,0,3,-0.1531
1,:50 p.m. UTC ? People in New York State Isolated people in were being tested for the said NYGovCuomo. Cuomos office said the risk for New York is currently low.,0,19,17,-0.6705
1,Li Wenliang: Chinese doctor who risked everything to warn the people of China about the new virus. Then he gave his life saving as many as he could.,0,3,2,-0.3182
1,this is devastating - coronavirus could hit the U.S. harder than other wealthy countries,0,0,0,-0.4215
1,Columbus News Japanese woman now has coronavirus after husband contracted disease following recent Hawaii trip - Honolulu Star-Advertiser,1,0,0,0
1,realDonaldTrump So many countries have already banned flights from China to protect their citizens from the CoronaVirus. WHY wont YOU,0,0,0,-0.1027
1,NEXT: A flight carrying evacuees has landed in Darwin. Were live to AneetaBhole for an update PLUS get the latest from az_journalist on on the quarantine situation there. Now on SBSNews,1,1,5,0
1,Kojima Productions has made the difficult decision to cancel our participation at the Game Developers Conference due to increasing concerns related to coronavirus. (1/2),0,528,3541,-0.5423
1,While most people avoided crowds over fears these men in Okayama Japan jostled for good fortune at the annual aked Festival ?,1,18,32,0.1585
1,Cyber criminals using Coronavirus emergency to spread malware via,0,3,0,-0.743
0,Man York isnt that far from me you know what I am gonna stay indoors and hide till this all blows over,0,0,8,-0.1779
1,annantwycross He actually names the virus and the origin! Wuhan,1,0,5,0
1,Fascinating displaying the spread of coronavirus. Check it out!,1,0,2,0.5848
0,THEY COMPLAINING TO THEIR WHITE GOD. AS SOON AS AFRICANS ACCEPT HOW THE WORLD PERCEIVES AFRICA AND HER PEOPLE YOULL STOP BEING SHOCKED AND SURPRISED.,1,4368,11254,0.0772
1,What you need to know about the symptoms and risks ??,0,54,69,-0.3527
0,Coronavirus will come to an end by the time summer arrives,1,1,4,0
1,always looking for the silver lining BBC News - : Nasa images show China pollution clear amid slowdown,1,1,3,0.3818
1,Coronavirus leaves MILLION on lockdown in cities as surgeon who treated sick becomes st confirmed death,0,0,0,-0.802
1,Wendys Im asking you and the Democrate party why you blocked the wall being build!! Now all of the United States is exposed to the Corona virus entering our Country! The sanuary States is a massive breeding ground for the virus to incubate. You democrates and Rinos have bloody hands,1,0,0,0.2677
1,SecAzar POTUS HHSGov VP . Why did you tell such a MASSIVE lie that a coronavirus vaccine had been developed in THREE DAYS???,1,0,20,0
1,Stock futures point to higher start as number of new coronavirus cases falls - MarketWatch,1,0,0,0.0772
1,Coronavirus gets its name from crown-like spikes on its surface (CDC). (Corona is Latin for crown.) Including the newly identified form of the virus there are a total of seven coronaviruses that can infect humans. Other well-known coronaviruses include SARS and MERS.,1,0,0,0
1,No Time to Die China Premiere Canceled Due to Coronavirus Concerns,0,0,0,-0.7269
1,there are kinds of viruses that can cause the common cold including: rhinovirus (culprit in % of cases) coronavirus respiratory syncytial virus influenza virus parainfluenza virus metapneumo virus enterovirus on average an adult catches colds per year,1,0,0,0
1,Toastie202 FrivviFox You dont need to be afraid of getting coronavirus of course but getting it because of the lack of fear is also not well ! ),0,0,1,-0.8678
1,iPhone supply delays could extend into April as suppliers battle coronavirus (AppleInsider),0,0,0,-0.2263
1,Dozens of people are dead in and more than infected as the Wuhan continues to spread throughout Asia and across the world.,0,0,0,-0.8307
1,Latest update: people have been confirmed infected. have recovered. have died.,0,16,30,-0.7783
0,ImohUmoren ochuko_atenaga Corruption is caused by coronavirus,1,2,9,0
1,Asmali77 The questions we must address now in regards to the are many very many,1,0,0,0
1,Coronavirus Outbreak Exposes Chinas Monopoly on U.S. Drug Medical Supplies via BreitbartNews,0,2,2,-0.128
0,TheJonasJuice Still... This shouldnt warrant a cancelation when there are other more dangerous viruses. Cancel cause the flu is deadlier this year or something like that but coronavirus??? Seems like an overreaction especially cause its foreign..,0,0,0,-0.3001
1,Leveraged ETFs That Gained More Than % at Halfway Q1 - the ongoing coronavirus crisis U.S. market bulls are marching higher with no signs of slowdown. This ..,0,0,0,-0.5719
1,Coronavirus outbreak in China: dead over infected as virus?spreads,0,0,0,-0.8176
0,Wilbur Ross says Coronavirus could boost US jobs,1,1,2,0.4019
1,So a man in Seattle died from coronavirus...,0,0,0,-0.5574
1,/ Solidarity in the Arts in Light of the Arosa Klassik and thus both my courses next week been cancelled due to very strict corona virus measures taken by the Canton of Graubnden. Well see what that means for me,1,0,0,0.3182
1,Japans Economy Already Wobbly Faces Big Blow From Coronavirus,1,0,0,0
1,Thank you &amp; to each of you for the coronavirus emergency funding. Your urgent &amp; quick response to this scary frightening virus is greatly appreciated.,0,816,2224,-0.3933
1,COVID-19 cases jump in Iran as Italy toll rises: Live updates,1,0,1,0
1,Sri Lanka Offers Friendship But Firm On China &amp; Tamils My Wednesday Column Lanka Modi Rajapaksa relations affairs,1,1,3,0.2382
1,This seems to be an objective analysis if the mortality rate of Covid .,1,603,948,0
1,??society in panic?!?? Hence no reports by that we are in the grip of an ?? Heed advice dispose of tissues properly wash hands regularly &amp; thoroughly therell be no need for panic!?? IMO: systems might be an issue methinks!,0,0,3,-0.738
1,DailyCaller Tell the Chinese Italians S Koreans Japanese Iranians... panic is dumb These nations are reacting/panic to a total threat to their countries. Closing cities and regions must say something,0,0,1,-0.875
0,yaneerbaryam Ill believe it when I see it. I think this is better explained by Chinese health system being maxed out and because so many people are self quarantining across China thats going to be very hard to maintain and with an incubation period so long it wont die out and surge again,1,0,0,0.3722
1,A hotel in Fujian Province in China where officials had placed people who might have had contact with coronavirus patients collapsed on Saturday night trapping dozens in the rubble according to officials and local news outlets,0,167,246,-0.2732
1,EEOC releases guidance for employers on Coronavirus as it relates to the ADA -,1,0,0,0
1,Amazon deleted million items for price gouging or false advertising about coronavirus,1,0,0,0.1779
1,Hackers are cashing in on coronavirus scare to send malware: How to stay?safe,0,0,0,-0.4939
1,China Halts Public Travel From Wuhan via YouTube,1,0,0,0
1,Researchers say the coronavirus may be more contagious than current data shows,0,0,0,-0.4005
1,Coronavirus: Two deaths from Japan cruise ship media report The pair in their,1,0,0,0
1,The Trump administration is suspending entry for days of most foreign nationals who have been in any of European nations in past two weeks.,1,0,1,0
0,Sind die komplett deppert? Austrian pharmacies recommend to fight ?Crazy greedy charlatans,0,0,0,-0.8426
1,MackayIM Gotta love how the person quoted as not caring about the name causing stigma for China doesnt seem to be from China,1,0,0,0.3761
1,Scary: Ghana Records Its First Case Of?Coronavirus,0,0,1,-0.4939
1,The doctor who reported the first case of corona virus was visited by Chinese police and forced to sign a document stating that he lied. He is now dead. Dont think it cant happen here. China To Investigate After Whistleblower Doctor Dies,0,2,0,-0.872
1,The -nCoV virus shows that we are built a better world,1,0,0,0.4404
1,Stopped for wine today and couldnt help myself. Asked cashier if news from China was undermining sales of Corona beer. She said no it actually seems to be boosting the brands sales,0,0,0,-0.666
1,Hashem is not very happy with this world!,0,0,1,-0.5434
1,ICYMI: I honored to have Chatham Police Chief Peter Volkmann a leader in Columbia County working on the front lines of the opioid epidemic as my guest for Tuesdays .,1,7,27,0.5859
1,taylorswift13 You be careful in Paris lots of prostesting going on there. Corona Virus is getting worse not better. Make sure you wash your hands as much as possible. Several cases in Paris,0,0,0,-0.7067
1,iingwen Taiwan and the mainland both belong to one China! Whether or not Taiwan join the WHO Do not be a separatist even Taiwan make English their official language even you think Taiwan was supported by American. But at least remember you are Chinese,1,0,0,0.1275
1,Coronavirus: Italy reports biggest daily jump in death toll,0,1,1,-0.5994
1,segue in when asked about the CDC report of Coronavirus in from China is that have it totally under control ?and that just signed the biggest deal ever with . ?What,1,0,0,0
1,I have a noon web meeting with European and UK colleagues. And I personally/professionally f$cking INCENSED right now about travel bans and blaming Europe and China,0,0,4,-0.7865
1,Coronavirus Live Updates: Singapore Closes Its Border With China,1,0,0,0
1,Olympic soccer qualifiers in China moved to Nanjing due to outbreak of deadly virus,1,0,2,0
1,Seems to have the growth rate of a pandemic,1,194,343,0.3818
0,US panic over reminds me of panic over . It has nothing to do with medicine or science. It has more to do with a culture of hatred based on stereotypes and fear?,0,2,17,-0.9325
1,awelab1956 afaduln2 businessinsider Its more than . People are dying and being left inside their homes.,1,3,2,0
1,I just learnt now theres a case of Corona virus in Lagos.. If any one notice any symptoms Please call Lagos State Emergency hotlines: Keep those numbers someone might be needing it soon,0,2,1,-0.0772
1,A must-read for all!! Do share as much as you can!,1,1,0,0.4724
1,Kanikou LaiKH5 annafifield Recovery rate is higher than the mortality rate of Coronavirus,1,0,0,0
1,Ive heard so many radio presenters &amp; the like casually say things like I dont wash my hands all the time and I dont get sick or I dont really know how spreads I guess its -insert ignorant nonsense- etc... this is so damaging to public health awareness. Stop,0,4,8,-0.429
1,I dont believe my big ears but someone on FOXTV just said What we need right now is a calm recitation of facts by people in authority. ?9 So far I havent seen a single piece of evidence indicating that is possible. has no horse-sense. I know these things,1,0,0,0.1531
1,ConflictsW Lealokkk Global_Mil_Info DewsNewz ISCResearch CNN DrTedros PolishPatriotTM OffLimitsNews Millie__Weaver LanceAndrews vcdgf555 Tominmedill AuroraIntel ChicomDragon realDonaldTrump libertytarian OANN JoceeeeCL GlobalnewsW BANDIT_XRAY vshih2 CGTNOfficial ZHAOSEN15 Seven cases of coronavirus noted in regions bordering Russia ?Ministry of Health,1,1,0,0
0,The bad viruses always come from China ...They were just called flu before DNA was understood ...,0,0,9,-0.7269
1,Salute to all the health workers in China. Theirs are acts of valour second to none!,1,1483,3674,0
1,TeamYouTube Fight4HongKong Dont you know Chinese people couldnt even visit youtube in normal way ? Then please explain what is the purpose to define coronavirus as sensitive topics,1,0,2,0.3182
0,Why is half of the British population panicking over bloody toilet paper and not over losing their at the end of this year? ?9,0,3,15,-0.6093
1,kateez08 and I literally sang BD to you HBD to you HBD dear Yunho HBD to you ?twice while washing our hands?? I highly encourage my mooties to do so too??,1,0,0,0.7994
1,Coronavirus Outbreak: Latest Updates,1,0,0,0
1,Coronavirus: Starbucks closes Chinese?branches,1,0,0,0
1,Are coronavirus diseases equally deadly? -,1,0,0,0
1,[Market] Ag Shippers Want More Container ree Time ?During Coronavirus?Outbreak,1,0,0,0.168
1,GreenWorks Prepares Decontamination Technology to Prevent Coronavirus?Outbreak,1,0,0,0.0258
1,semagnes Eyes closed. Tobacco kills more than million people a year. Still were more afraid of corona,0,0,1,-0.5423
1,FreedomHKG bb20428139 Hong Kong will become another Wuhan if its borders are not closed soon enough?? Please help by signing this petition?????????,1,0,0,0.7149
1,Judicial Watch - Epidemic of Government Employees Watching Porn on Taxpayer Time -,1,0,0,0
1,Coronavirus fears similar to what Vancouver Olympic organizers faced with H1N1,0,0,0,-0.4215
0,is now a hoax? Wow....but yeah build the wall Mexico will pay for completely,0,0,1,-0.0772
1,ItsMainaKageni we have a very sick government!! So they have let in a plane full of people from China and we have no controls in place to fight the virus. Some of those people came for business dealswill they self quarantine really,0,0,0,-0.8392
1,Reports say that all theaters in have been temporarily shut.,1,0,1,0
0,Lemme say something the general Media hasnt. This Coronavirus outbreak definitely is not something to absolutely freak out about like the media is. A Coronavirus is similar to the flu. The flu has killed over k people in America just last year who had weak immune systems,0,0,0,-0.8553
1,Check this flow chart before you freak out. If you can breathe normally you probably ust sick ???,0,0,0,-0.7744
1,Americans Are Released From Coronavirus Quarantine At California Air Base,1,0,1,0
1,Cruises Sail On In Spite of Coronavirus,0,1,1,-0.5267
1,Chinas stock rebound shows force of national team ? via financialtimes,1,0,0,0
1,trading heavy with US yields into the NY close. back up to handle. WHO delays decision by a day on whether to declare an international emergency (CNBC) $JPY Daily,0,0,0,-0.3818
1,Last month caution and confidence ruled the markets as prices surged only to drop with the spread of the coronavirus.,1,0,0,0.296
1,Although we are in Indonesia we are always carefull of Corona Viruses Out Break with always wear a mask when going outside house or in public places because its only our self can prevent that viruses!,1,14,20,0.1007
0,Pharmaceutical companies will get part of the billion; Executives will get part of the billion; CEOs will get part of the billion; Billionaire and Millionaire families will get part of the billion; everyday workers will get.....a tweet!,1,192,501,0
1,Coronavirus: Passengers from Italy not checked at UK airports,1,0,0,0
1,Wow just learned that coronavirus is the term for all influenzas the new coronavirus doesnt actually have a name yet ?,1,0,2,0.5859
1,Outbreak complicates the SoftBank-backed hotel chains efforts to stem mounting losses,0,0,0,-0.4019
1,This guy is crazy take the last train to wuhan to stay there to report the ugly truth in wuhan respect (he said he has prepared to die there),0,4395,14696,-0.5106
1,olliegothgirl Shaymar15 And not beneficial to Zimbabwes cholera outbreak.,0,0,1,-0.3412
1,Hundreds of worshippers at Christ Church Georgetown in Washington DC asked to self-quarantine - after the church rector became then citys first confirmed coronavirus patient. See NE-027MO.,1,0,1,0.2023
1,Singapore expects economy to be hit by Wuhan virus is now screening every flight landing at Changi Airport.,1,2,0,0
0,Coronavirus outbreak stemmed from a snake this is how u know them man are juj wa majuj they eat everything,1,0,0,0
1,GOP realDonaldTrump The situation in Wuhan subway ...,1,156,280,0
0,ForeignPolicy BeijingPalmer china wants transparency? their brainwashed officials wont do that. their habit is to report whatever their bosses want to hear for the sake of survival. you cant change those robots overnight.,1,1,3,0.0772
0,ChangeIsGood58 peyote_radio JoeyOfTheWorld There seems to be epidemic. Imagine only one person handling press questions. Guess they have never of one person one story and stick to it. Unlike Rudy doing his own style of Hip Hop that undermines Thump,0,0,1,-0.34
1,Shahzaib Rahujo who studies at a university in China around kilometres away from Wuhan reached his village late Saturday night.,1,1,3,0.1027
1,China stimulus hints slowing spread of virus lift stocks,1,1,3,0
1,Employers have been urged to postpone business travel to China following the Coronavirus outbreak.,0,2,0,-0.2263
0,hoopwitniyaa Chinese Billionaire claims over people died and Million are infected by Coronavirus. Watch it here:,0,0,1,-0.7783
1,Americans On The Diamond Princess Cruise Ship Diagnosed With Coronavirus,1,0,0,0.34
1,cnnphilippines Going to the epicenter of a virus outbreak without sufficient protection isnt just brave. Its reckless stupid and an unnecessary risk and sacrifice of brave (read: healthy) Filipinos. Why add to the victims when you can just prepare better &amp; reduce/limit the risks involved,0,13,118,-0.9224
1,Coronavirus infections have a wide range of symptoms including fever coughing shortness of breath and breathing difficulties. Severe cases can cause pneumonia severe acute respiratory syndrome kidney failure and death,0,0,1,-0.9274
1,Bakistani bachhe stand in full solidarity with all weather fraand and refuse to leave affected Cheen. This is true love - to live together in happiness &amp; die together in disease just like Mian - Biwi. Maa shaAllah!,1,5,6,0.8268
1,British Columbia identifies new cases of novel coronavirus bringing total to |,1,0,0,0.3182
1,GovMikeHuckabee ...it has a great ring to it since more and more Americans are realizing who trashed the Civil Rights Bill Who open SocialSecurity Who gave Panama Canal away Who recognized China Who signed,1,0,0,0.6249
1,Coronavirus Live Updates: An American Dies of the Virus in Wuhan China,1,0,0,0
1,Korea has been doing such a great job! I just a lil bit worried what happens when we reach the tipping point and the health system gets overwhelmed,1,10,15,0.5411
1,MOH releases list of referral hospitals for?coronavirus,1,0,0,0
0,Which is more believable? A - The CDC got it wrong. B- Trump got it wrong and the CDC is taking one for the team here.,0,7,39,-0.7351
1,No plans to set up coronavirus quarantine site in B.C. for now: health officials - Boundary Creek Times -,0,0,0,-0.296
0,Those stupid surgical masks and all the other goofy shit be wearing isnt gonna protect yall from catching the coronavirus lol,0,0,1,-0.7494
0,Do you reckon if coronavirus were to kill John Wicks dog he a.) Kill the coronavirus by killing all couriers b.) donate his pure blood cells of gods to analyse to make an godlike antidote,0,1,3,-0.9413
1,vgaph I didnt drop it. The people most affected are ethnically Chinese. The countries with the largest populations of ethnically Chinese seem to be hit the hardest. Flights have been going in and out of China for a month now and look at the stats,0,0,0,-0.0204
1,S&amp Dow hit all-time highs as coronavirus spread slows or they are running out tests kits just as they said they were,1,0,0,0
1,I just posted Second case of coronavirus in Toronto confirmed by federal health officials - newsinfos on Reddit,1,0,0,0
1,cnni Something else from the report. Over % of patients who were diagnosed and admitted to the hospital with the are still there. That means the recovery time is measured in the weeks in not months.,1,0,2,0.1027
0,any virus bacteria protection for children good to have on hand for trips to doctor air port etc... Our favorite pattern Amazon has lots of choices overnight,1,0,0,0.8689
0,There is absolutely no doubt in my mind that this virus is out of control and governments worldwide are not transparent in disclosing information so as avoid mass panicking.,0,5,12,-0.8641
1,RepAdamSchiff Trump is just a horrible human being. He is one of the worst human beings. Look at how he is lying about the coronavirus stuff,0,0,0,-0.9001
1,Coronavirus brings Chinas surveillance state out of the shadows | Article [AMP] | Reuters,1,1,0,0
0,have a thought maybe china set this loose to retaliate for sanctions and screw with our economy and i think trump knows the book eyes of darkness by dean koontz describes this situation to the tee,0,0,0,-0.6155
1,Jaguar Land Rover UK output threatened by coronavirus-linked parts shortage,0,0,0,-0.6124
1,Coronavirus: Italy reports deaths in one day,1,0,0,0
1,cdnfp TerryGlavin rolandparis nspector4 nytimes CliveCHamilton cburton001 FredLitwin raykwong vshih2 GordonGChang David_Mulroney globeandmail nvanderklippe cafreeland Rory_Medcalf RalphGoodale JustinTrudeau csiscanada ASIO FBI AaronFriedberg elyratner FenellaSung1 washingtonpost DrBeeZee MichaelAuslen Colinfreeze HonJohnMcCallum ianjamesyoung70 CanadaChina CanadaFP CSIS cse_cst NSAGov DHSgov GCHQ stevenchase TorontoStar nationalpost jmohanmalik MichaelDanbyMP TheJusticeDept WHNSC PekingMike PnPCBC dfat ewong !!! chair of the department of chemistry and chemical biology...was paid $50000 a month by the University of Technology in and living expenses up to $158000 FP_Champagne univcan,1,14,6,0
1,$SPY Peak Coronavirus? Clothing giant H&amp;M has reopened stores in China and may reopen more this week. /520 are currently closed,1,0,1,0
1,Our school giving letter regarding the corona virus.. inform the kids not to attend school if they are not feeling well.. ask if they have relatives who came from china and were in contact with them... and possible suspension of classes,1,0,1,0.257
0,BBCHARDtalk The Coronavirus outbreakis the biggest global alert that we must act is linked to the loss of biodiversity deforestation atmospheric pollution the only way to combat all of this is with Education for HealthSustainability. Join Us Now,0,0,0,-0.0772
1,Coronavirus: Republican senator tells Trump to the professionals do the talking after he repeatedly contradicts expert health advice A Liar Lies Trump Proves Daily That One Fact realDonaldTrump,0,0,0,-0.8176
1,* Coronavirus threatens World Indoor Athletics championships in Nanjing,1,0,0,0.1531
0,BIOWEAPON Open Philanthropy Project funds John Hopkins Center for Health Security. John Hopkins hosted EVENT . A Coronavirus simulation in Oct .,1,1,0,0.34
1,Japans health minister asked citizens to avoid crowded places like subways. This coronavirus is causing states to adapt by radically altering their way of life. How long will this last?,1,0,3,0.0772
0,That video from China (if real) is pretty disturbing,0,0,0,-0.0258
1,USA still receiving things from China post. If money is an issue then I assume mail would be,1,0,0,0
