veracity,content,sentiment,retweet numbers,likes numbers,compound
0,MCI advisory being circulated on social media stating u MBBS UGs and students will be recruited for assistance in healthcare against,1,230,352,0
0,Nagpur has tested positive coronavirus cases including doctors,1,1703,6954,0.5574
0,The Government is likely to impose Financial Emergency in India to tackle the crisis caused by,0,801,1721,-0.836
0,The risk of in India has been reduced due to noise produced during the,0,367,759,-0.2732
0,Paracetamol can treat coronavirus infection,1,68,130,0.4019
0,Coronavirus survives only for hours,1,1107,2620,0
0,The vibration generated by clapping together will destroy infection,0,1532,3054,-0.5423
0,Angry Citizens Did Not Place A Naked Statue Of Trump In New York City Due To His Inability To Contain COVID-19 Situation,0,0,0,-0.7184
0,The worlds cutest baby Anahita Hashemzadeh has been diagnosed with coronavirus. Please pray for this baby,1,0,2,0.8126
0,Cocaine is a cure for COVID-19,1,9,57,0
0,OMG: China needs coronavirus SWAT (special weapons and tactics) police team to arrest this drop dead virus victims,0,1044,1421,-0.9228
0,Only in China: Medical SWAT teams with riot shields and dog-catcher nets practicing to catch a person with coronavirus symptoms,0,226,475,-0.5574
0,Large Explosion in Wuhan China just happened about an hour ago /24/2020,1,183,202,0
0,China Muslims hidden at Bihari mosque has been taken to corona virus test by Bihari police. Erode police has caught Thailand Muslim mullahs infected with corona virus. Today Salem Police has caught Indonesian Muslim mullahs at Salem mosque. This video shows u they are applying and putting saliva on spoons plates and utensils and also they are in the intention of spreading corona virus disease. Nobody knows whats happening in the Nation (sic),0,8,12,-0.4939
0,Muslims Licking Plates to Spread Corona,1,0,0,0
0,ffice Memorandum ?claims u the Ministry of Health & Family Welfare has issued a clarification regarding declaration of holidays in four states namely Maharashtra Gujarat Uttar Pradesh and Sikkim,1,4,2,0.3818
0,Two facilities in Wuhan are linked to covert Chinese biological weapons programs,0,987,1145,-0.4404
0,France confirms two cases of deadly coronavirus,1,232,361,0
0,Two facilities in Wuhan are linked to covert Chinese biological weapons programs. Did the deadly coronavirus escape from a BW weapons lab,0,470,756,-0.6249
0,So...the Chinese government is busy killing protestors in Hong Kong while the entire city of Wuhan is suffering from an outbreak of Coronavirus u may very well spread worldwide killing millions,0,18,143,-0.8887
0,Chinese people trying to walk home in wuhan china,1,3814,15261,0
0,Everyone who has visited Macau for SS8. Please check the below link. Many Wuhan ELF stepped forward to tell us where they were at during the concert and suggest everyone in the area to be extra careful. They are currently fine but better to play safe,1,395,304,0.9209
0,Liang Wudong a surgeon who was treating patients in Wuhan just become the first doctor to die from the new Coronavirus. A reminder u while everyone else is trying to avoid it frontline medical staff are risking their lives to cure it + save others,0,8020,8295,-0.6369
0,Regards to the current Wuhan Virus (2019-nCov) have to ask a question on why it outbreak in Wuhan ss Chinese outside Wuhan dont eat bats & frog he answer is simple the only P4 lab in China located in Wuhan. Its a man made virus rather than come from nature,1,23,33,0
0,so far; - orld war ?- iran plane crash - australian bushfires - volcanic eruptions - earthquake in indonesia - jakarta flood - wuhan coronavirus outbreak,0,1933,1992,-0.7823
0,person refuses to leave home and get tested for . So others simply block him from coming out. This is the way to deal with the,0,531,646,-0.5209
0,BREAKING: Three Chinese nationals were admitted to the San Lazaro Hospital in Manila after displaying symptoms of flu an official of the hospital confirmed. Two of them have travel history from Wuhan China the center of the novel coronavirus. | via MBMinkaTiangco,1,461,872,0.0258
0,JUST IN: Health Sec. Francisco Duque confirms Chinese nationals were admitted to San Lazaro Hospital in Manila after showing signs of flu; says of them have travel history from Chinas Wuhan City the center of the novel coronavirus ?outbreak,1,610,928,0.0258
0,Its absolutely ridiculous u governments worldwide are only checking people u have travelled to Wuhan as it is completely spread throughout china Asia and several other countries. And to add to this it may lay dormant for up to weeks,0,0,0,-0.4201
0,So theres this conspiracy theory going around about the Wuhan coronavirus being engineered in u military biotech lab in Wuhan ?which Im not inclined to believe heres why. I think the truth is even more uncomfortable; and resorting to a conspiracy theory is a cope,0,20,74,-0.8821
0,person refuses to leave home and get tested for . So others simply block him from coming out,0,531,646,-0.5209
0,Commy is going there to fight the monster virus I will be back soon. ?144 medical personnel from Chongqing Emergency Medical Centre left for Wuhan last night,0,1609,5090,-0.6369
0,Malaysia is one of the top countries in the world in terms of being prepared for major infectious diseases. We are in fact number one,1,5914,6379,0.4588
0,The Coronovirus in Wuhan sounds like it is a Bioweapon u was released by a nearby Bioweapons lab,1,3,6,0.3612
0,The Huanan seafood market in Wuhan has been widely considered the source of the outbreak of a novel coronavirus. But the virus may have infected people elsewhere first a new paper suggests,0,106,130,-0.5647
0,The number of official cases in Wuhan went from to in one day,1,205,362,0.0772
0,OP-ED: Abolish Asias Markets ?Where Breed | By Christian Walzer and Aili Kang for The Wall Street Journal Consumption of wild meat appears to be to blame for the virus as it was for in,0,44,0,-0.34
0,the hoseok fanbase in china has donated bottles of disenfectant doctors caps pairs of surgical gloves medical bed sheets and doctors gowns to the red cross in wuhan,1,468,1263,0
0,The state of California has declared u they are well-prepared to handle the if cases would appear in the state. Im not so sure about u after seeing this video from,0,1344,2182,-0.3556
0,just wanted to ask duterte when hes planning to not accept flights from china? maybe when all Filipinos are infected or when he is already experiencing it firsthand? just wanted to ask since chinese locals from wuhan are being suspected near our area already. pls take actions,0,12,54,-0.7464
0,Officials visiting hospitals with N95 masks and doctors in flimsy regular surgical masks. And no gloves,0,49,56,-0.296
0,Bill Gertz reporting is correct China was using Wuhan facility for bio weapons research - buried in the civilian stuff. But no evidence u coronavirus is a bioweapon gone wrong. In part because its not killing many people. And the Chinese have some quite unpleasant weapons,0,33,34,-0.9112
0,Wuhan doctor who shared info about on social media on Dec before govt lifted info blockade punished by police on Jan . Hes now in ICU with virus. Interview with him from China Youth Daily deleted from WeChat,0,80,84,-0.1531
0,medical experts call for draconian measures to stop the spread of the virus estimating u tens of thousands are already infected and warning a global epidemic could be imminent,0,373,367,-0.7783
0,BREAKING: Hubei province has confirmed new cases of Wuhan coronavirus on Monday *alone* and new deaths have been reported the provincial govt said in a statement,1,2682,4743,0
0,How come none of the media coverage on the Coronavirus mentions u it originated from a city u houses Chinas covert biological warfare program,0,769,1444,-0.296
0,dont be ignorant about wuhan/coronavirus. stop saying stays are dumb for wanting to protect the boys by telling them to cancel hi touch so they wont be infected. it may not be in your area as much but its serious since theres no cure or vaccine for it and can be spread easily,0,125,331,-0.0974
0,People collapsing at any minute in China during . One photo is from Dongdaruifa shopping mall at Yangzhou Jiangsu Province one from Xidaruifa shopping mall at Yangzhou one from Hongqiao railway station in Shanghai,0,853,855,-0.296
0,Jan - confirmed cases Jan - sick Jan - sick dead Jan - sick dead Jan - sick dead Jan - sick dead Jan - sick dead Jan - sick dead Today- sick dead,0,60,93,-0.9957
0,All this American media-sponsored hysteria over coronavirus?like these fucking anti-vaxxers arent in our backyard tryna kill us with their bacteria-infested spawn,0,3095,14051,-0.8225
0,Coronavirus reported in countries bliksem! So now its spreading from human to humanhow prepared SA authorities are? People who visited China from neighboring countries might cross our unguarded borders easilyegpregnant wife looking for better hospitals crossed through....,1,22,53,0.6239
0,wear your masks do everything to protect yourselves cos this government cant even,1,31100,56700,0.3818
0,PSA for everyone freaking out about this coronavirus: A country u YouTubed itself into a st Century measles outbreak does not get to talk any shit about anyone elses health practices,0,30548,136123,-0.7506
0,Another day another victim falling down in the middle of public in China,0,6,12,-0.4019
0,Hi! Paala lang. Hindi porket may nCoV ay mamatay na. As a matter of fact less than % lang ang mortality rate nito. Mas nakakamatay at nakakahawa pa ang seasonal flu,0,21,84,-0.4199
0,Pakistan not to evacuate its citizens from virus-hit Wuhan to show solidarity. Until now Pakistan had only sold its national assets to China. Now it is selling its citizens too,1,1854,6122,0.4404
0,Another shocking footage u shows people deliberately spreading the deadly virus. This time in what looks like a hospital in China,0,7299,3917,-0.0516
0,In Italy people are being kept on board a cruise ship as tests are carried out on two Chinese passengers suspected of having,0,122,176,-0.2263
0,Coronavirus is a BLANKET TERM for various viruses. THE COMMON COLD IS A CORONAVIRUS. MERS IS A CORONAVIRUS,1,23758,72119,0
0,At this time the risk to Americans remains low and we are working to keep it u way. We will continue our work to monitor respond to and mitigate the spread of the and ensure u Americans have the most accurate and up-to-date health and travel information,0,22,57,-0.1531
0,During the Taal eruption we were reminded u the disaster fund was cut by billions. Now in the time of nCoV let us be reminded u the budget for health was also cut by billions. For intelligence and military fund. Let us fucking kill this government,0,5230,16487,-0.8805
0,The last time the U.S. quarantined citizens to prevent the potential spread of disease was in the s over smallpox,1,59,0,0.0258
0,Working closely with China and others on Coronavirus outbreak. Only people in U.S. all in good recovery,1,22252,135061,0.4404
0,Scientists say figuring out the connection between climate change and the spread of disease is the only way to develop better public health strategies,1,105,243,0.4404
0,BREAKING: Fourth case of coronavirus set to be confirmed in Canada,1,544,1497,0
0,Stop eating meat to stop Corona Virus. Because Corona Virus come from wild or domestic animals. If you meat of it then it(virus) will spread,0,40,37,-0.5267
0,Eating meat is a heinous sin. It increases the risk of cancer and other deadly diseases. Like the corona virus came from the meat market,0,16,18,-0.8225
0,Coronavirus Contains IV Insertions ? Stoking Fears Over Artificially Created Bioweapon,0,440,688,-0.2023
0,Stop killing innocent animals for the taste of tongue. It is against the rule of God. Saint Rampal Ji Maharaj China Must watch sadhna TV :30pm,0,468,462,-0.4767
0,China is suffering the fatal effects of corona virus due to eating meat by breaking the constitution of God,0,5,7,-0.6705
0,Eating meat is not a command of God and eating meat is a big sin. if we still do not follow the rule of God then corona virus and other terrible viruses can also arise,0,813,805,-0.8529
0,Recently in some countries meat has been banned due to Coronavirus. But the order to eat meat is not even of God because meat is not written in the holy book of any religion. Eating meat is not the order of or God,0,265,256,-0.6643
0,But honestly being in China gives you a better chance to get treated when you have the corona virus than here in Botswana and yes we love our people but traveling is very selfish given you putting a nation of just million in danger some sacrifices have to be made at times to,1,117,342,0.8888
0,Spiritual knowledge begins when science ends. Science also fails in such disasters. Satbhakti is the only protection against such fatal diseases like cancer corona virus,0,539,532,-0.9153
0,China has another health scare to contend with an outbreak of a highly pathogenic strain of H5N1 bird flu at a farm in the southern province of Hunan,0,3080,2321,-0.7251
0,New coronavirus update: Yesterday evening: new cases deaths. This evening: new cases deaths,1,43,68,0
0,Thai doctor says new drug combination treated coronavirus patient,1,78,241,0
0,There are now at least confirmed cases of Wuhan coronavirus in countries and territories outside mainland China with Sweden and Spain reporting those countrys first cases over the weekend,1,111,197,0
0,Hannity asked Trump about the coronavirus. Trump replied Weve pretty much shut it down.,1,0,2,0.4939
0,Coronavirus has wreaked havoc in just a month across continents. As of January more than people have died in China and infected more than,0,4,6,-0.8934
0,A coronavirus R0 (R naught) > value would suggest aerosol transmission. The Chinese state media Xinhua report of hand to mouth transmission is likely disinformation from the Wuhan Institute of Virology the possible true errant source of the virus,1,40,61,0.296
0,Finally have a president who stands up to China and puts Americas workers FIRST. Thank you President Trump,1,725,3966,0.3612
0,Bus transport sector and airline industry recruiting people to join unions and planning strikes. They are likely the next sectors to take industrial action after healthcare sector. All are calling for a full border closure to contain epidemic,0,141,198,-0.0772
0,Wuhan officials were accused of cremating the dead in secret last week and a crematorium employee claimed the rumors are true as China adopts draconian measures to treat the outbreak,0,763,753,-0.0772
0,Extraordinary news from government. They cant cope & so drafting in staff on a voluntary basis & retirees This is the crisis appalling incompetence arrogance intransigence and absence of leadership has led to combined with repression of truth,0,1597,1696,-0.9274
0,Today Chinas Ambassador to the US AmbCuiTiankai did NOT deny u emanated from their biological weapons program - a strange interview to say the least. We need a lot more transparency from China on this virus,0,597,827,-0.3948
0,Chen Qiushi a citizen journalist who had been doing critical reporting from the epicenter of the outbreak went missing on Thursday evening just as hundreds of thousands of people in began demanding freedom of speech online,0,8900,11515,-0.0516
0,Some people say u racism will die out when certain generations die but it wont because they keep teaching their children & grandchildren how to be racist and ignorant,0,3468,9362,-0.9331
0,American televangelist Jim Bakker is selling a liquid u allegedly ills ?the coronavirus for $300,1,1682,3309,0
0,Coronavirus deaths by date. th of January: th of January: th of January: rd of February: th of February: Today:,1,6520,12052,0
0,With the CDC confirming the first case of the Wuhan coronavirus here in the United States in Seattle Washington there are definitely more cases than have been estimated. The virus has an incubation time of days so people probably traveled internationally without symptoms,1,471,1070,0.6705
0,The United States has its first confirmed case of a new virus u appeared in Wuhan China last month. The coronavirus has already sickened hundreds and killed six people in Asia,0,137,218,-0.7351
0,CDC has activated its emergency operations center. They expect more US cases,0,265,611,-0.3818
0,BEWARE! THE CHINA VIRUS HAS LANDED IN US,1,203,100,0
0,Hong Kong located right next to mainland but surprisingly having case of and not imposing any effective preventive measures while the number of cases in China increases by hundred every few hours and other farther countries have confirmed cases as well,1,19,49,0.4612
0,Latest on new coronavirus emerging from Wuhan China: now dead from the respiratory infection; stock prices of mask companies are rising; a case has been confirmed in Taiwan which joins South Korea Japan and Thailand as sites where virus reported,0,0,7,-0.6486
0,Pregnant women who get vaccinated pass antibodies to their babies. u means when you get vaccines during pregnancy you arent just protecting yourself ou are giving your baby some early protection too,1,229,412,0.34
0,Breaking News: An individual in Washington State is infected with the Wuhan coronavirus the first such case in the U.S. The outbreak which began at a market in China has now spread to at least four other countries,0,41,27,-0.4939
0,Killer Chinese virus comes to the US CDC says This is another Ebola China testing their own biological weapon on its citizens,0,7,5,-0.7579
0,This is a man-made patented virus with a vaccine in the works. Fear sells,0,228,332,-0.4939
0,There is no federal dosage limit on opiate pain limits,0,73,179,-0.6705
0,CDC testing several people in US for possible Wuhan virus,1,0,1,0
0,CORONAVIRUS UPDATE: Chinese city of Wuhan shuts down all outbound flights and trains after virus kills . No one will be allowed to leave the city after a.m. local time,0,211,235,-0.7096
0,The language the CDC uses is actually effectively no risk,0,15,35,-0.1027
0,CDCs Vaccine Schedule May Be Harmful To Children,1,128,175,0
0,CDC Admits Million Americans Were Given Cancer Virus Via The Polio Shot,0,55,51,-0.4939
0,STOP ALL TRAVELERS FROM CHINA FROM ENTERING THE U.S,0,550,1973,-0.296
0,Current shot of CDC page. Not warning against non-essential travel,1,9,24,0.2584
0,A California woman can no longer speak or care for herself after using a skin-lightening cream u contained toxic mercury,1,50,45,0.25
0,Handwashing is one of the most effective ways to prevent the spread of germs,1,216,260,0.5413
0,Residents should remain in Wuhan except under extraordinary circumstances according to local government announcement,1,53,61,0
0,The Chinese family of five arrived in Hong Kong via the high-speed rail to take a connecting flight to Malaysia. While the patient stayed in Hong Kong to seek medical help due to fever the rest continued their journey,1,357,259,0.4019
0,emergency committee has decided to meet again tomorrow to decide whether to declare the outbreak as PHEIC for the need for more evidence,0,94,136,-0.3818
0,China is trying to lock down Wuhan to try and slow the spread of the new virus. Public health accepted wisdom is u this sort of action is pretty futile,1,8,5,0.7003
0,The death toll in the outbreak rises overnight from to :,0,33,31,-0.5994
0,All people in public places in Wuhan are now required to wear masks local government says,1,197,220,0
0,The US opioid epidemic driven by a profit-hungry medical and pharmaceutical industry is still killing tens of thousands of people each year,0,5,7,-0.6597
0,While Iran is using real Chemical weapons to terrorize nations Nigeria is using Chemical Brother and sister to disturb twitter! The fight has grown epidemic and everyone is a part of the chemical charade,0,19,28,-0.9151
0,Latest research published today in TheLancetPH finds no vaping epidemic in NZ,0,6,8,-0.296
0,jenny mccarthy is deadass responsible for a global health epidemic. she should be sent into space,1,730,4426,0.3182
0,WHO calls for emergency meeting on new China virus as cases spread Maybe next they can call for an emergency meeting on the autism epidemic,0,88,269,-0.6369
0,results derived from our evolutionary analysis suggest for the first time u snake is the most probable wildlife animal reservoir for the -nCoV based on their similar codon usage bias,0,36,60,-0.1027
0,CDC IS WORKING TO GET EMERGENCY USE AUTHORIZATION FROM FDA FOR A DIAGNOSTIC TEST TO DETECT THE WUHAN CORONAVIRUS: POLITICO,0,40,53,-0.3818
0,Everyone please take care. This Wuhan virus really spreading like wildfire,1,260,313,0.8062
0,locks down more cities including public transportation markets & theaters an effort to contain the . million people live in locked-down cities,1,0,1,0
0,only special hospitals accept patients in wuhan,1,73,77,0.6486
0,The global count of confirmed Wuhan coronavirus cases now stands at with of those in mainland China,1,103,202,0
0,Residents in Wuhan waiting to be treated. Many have been turned away refuse treatment due to lack of capacity in the hospital died home. Death released only include those being officially diagnosed,0,651,1015,-0.9001
0,China had hundreds of people infected by the Wuhan Coronavirus outbreak last year and kept it quiet for months,0,1302,3937,-0.4939
0,CORONAVIRUS: /2 We have put in place proportionate precautionary measures building on those already in place in Wuhan and are closely monitoring the situation. A Port Health team is meeting each direct flight from Wuhan to provide advice and support to those u feel unwell..,1,280,521,0.4019
0,If this takes days to incubate how effective is screening via patient temp? Just askin you seeA post from Wuhan Railway saying u people traveled by train out of Wuhan on Wednesday headed to every corner of the country was also quickly deleted.,1,36,83,0.4767
0,Chinese doctor in the city of Wuhan in tears announcing u there are too many cases of sick people,0,41,89,-0.6369
0,Maybe we should spend less time blaming the people trapped inside Wuhan and more time blaming the system and leaders u fed them lies and cover-ups placing face-saving measures above the lives of citizens,0,62,180,-0.901
0,Chairman Xi has acknowledged the Wuhan outbreak This means it became too big for them to cover up,1,1190,2783,0
0,Should we be worried about coronavirus in ? Yes and No.. The chance of people getting the virus is low,1,3333,456,0.1027
0,Epidemic : the situation seems catastrophic in,0,267,218,-0.4939
0,China spent the crucial first days of the Wuhan coronavirus outbreak arresting people who posted about it online and threatening journalists,0,79,100,-0.5267
0,The Wuhan Virus is just another demonstration as to how people completely lose their minds concerning all things China,0,1071,1427,-0.3804
0,In order to avoid the further spreading of Coronavirus anybody leaving Wuhan and causing spread of Coronavirus will be sentenced for years ?said by authority,0,24,11,-0.25
0,Philippines stops accepting flights from Wuhan origin of new coronavirus,1,233,1205,0.25
0,Philippines deporting travellers arriving from China,1,95,127,0
0,Most of the past epidemics were controllable but this time,1,0,0,0
0,China has officially been blockade on JAN rd due to the chronic wide spread condition mean while and has still NOT FORBID flights and trains from wuhan to Hong Kong,1,169,176,0.3621
0,The patient was not reported to have any prior medical conditions,1,391,237,0
0,This reports key findings are alarming. The authors predict u by February up to people in Wuhan could be infected by the corona virus. The virus will also further spread to other transport hubs like Beijing and Shanghai. the time to act is now,0,397,481,-0.296
0,It is a man-made disaster,0,959,1192,-0.6249
0,Inside a hospital in wuhan the woman said some people died already in mid-night lack of doctors and no government officers are visiting; patients are just lying on the ground,0,1,5,-0.8885
0,Not a train to Busan But a plane from Wuhan,1,502,218,0
0,[The medical team collapsed] [Wuhan Medical Care is asking for help,1,3368,2723,0.7096
0,Virologist Who Visited Wuhan Says Coronavirus is out of Control,1,2368,13738,0
0,HEALTH PSA: -Avoid close contact with people who have active symptoms of disease -Wash your hands thoroughly (at least seconds) and often especially after sneezing or coughing -Dont let Kathy make you soup -Avoid China men,0,16,55,-0.1779
0,Nobodys come to manage this. ?This video allegedly shows dead bodies lying in hospital,0,3254,2846,-0.8271
0,She is a doctor in Wuhan... If she quit. The local government will revoke her doctors qualification and ban doctors from publishing the true situation of the hospital,0,10128,3741,-0.2023
0,has a history of not accurately reporting outbreaks so its hard to know exactly what is happening especially with no free press internet etc,1,1423,2605,0.1045
0,Theres one difference between the Wuhan virus and previous outbreaks in the region: China is now impossible to quarantine,1,1,2,0
0,China has locked down more than million people,1,20,22,0
0,Of all the aspects of the rapidly spreading Wuhan virus this is perhaps the most alarming: A single patient has infected health care workers. us whats called a super spreader -- and identifying them is a key element of fighting the virus,1,679,788,0.1548
0,This says u the now realized the is out of control. In alone K have been infected. They plan to replace the current leaders of Wuhan and Hubei. More cities can be locked-down the entire country can be put under military control & emergency status,0,13,24,-0.7783
0,Calling herself ?& claiming to work in one of the hospitals in Wuhan says the number of people u have died due to the is,0,1248,1277,-0.5106
0,In the month and a half since the Wuhan coronavirus emerged as a new disease it has killed people so far,0,827,4100,-0.6705
